"AU","AF","DE","AID","OT","PHST","DT","AB","C1","OI","CI","COIS","CON","CRDT","DCOM","DEP","PY","EDAT","EIN","GR","IS","SN","JID","SO","LA","LID","LR","MHDA","MID","OAB","OABL","OTO","OWN","PP","PL","PMC","PMCR","PMID","PST","RN","SB","SI","SO2","STAT","J9","TI","TT","VL","DI","DB","ID","RP","TC","CR","AU_UN","AU1_UN","AU_UN_NR","SR_FULL","SR"
"SAHIN E;YESILCINAR I;GERIS R;PASALAK SI;SEVEN M","SAHIN, EDA;YESILCINAR, ILKNUR;GERIS, RUVEYDA;PASALAK, S INCISER;SEVEN, MEMNUN","FEMALE;HEALTH KNOWLEDGE, ATTITUDES, PRACTICE;HEALTH LITERACY;HUMANS;LIFE STYLE;PERCEPTION;PREGNANCY;PREGNANT WOMEN;TERATOGENS","10.1080/07399332.2020.1797036 [DOI]",NA,"2020/08/04 06:00 [PUBMED];2021/11/24 06:00 [MEDLINE];2020/08/04 06:00 [ENTREZ]","JOURNAL ARTICLE","THIS STUDY WAS CONDUCTED TO DETERMINE PREGNANT WOMEN'S HEALTH LITERACY LEVEL AND ITS EFFECT ON HEALTH-PROMOTING LIFESTYLE AND PERCEPTION OF TERATOGENIC RISK RELATED TO MEDICINE. THE SAMPLE OF THE STUDY CONSISTED OF 326 PREGNANT WOMEN. WOMEN WITH HIGH HEALTH LITERACY HAVE MORE HEALTH-PROMOTING LIFESTYLES AND LOWER TERATOGENIC RISK PERCEPTIONS TOWARD USING ANTIDEPRESSANTS AND INFLUENZA IMMUNIZATION DURING PREGNANCY. THIS STUDY GIVES BASELINE DATA ON HEALTH LITERACY AND TERATOGENIC RISK PERCEPTION OF MEDICINE USAGE DURING PREGNANCY IN TURKISH WOMEN.","OBSTETRIC AND GYNECOLOGIC NURSING DEPARTMENT, HEALTH SCIENCE FACULTY, GIRESUN UNIVERSITY, GIRESUN, TURKEY.; NURSING DEPARTMENT, HEALTH SCHOOL, BATMAN UNIVERSITY, BATMAN, TURKEY.; MEDICALPARK HOSPITAL, SAMSUN, TURKEY.; SCHOOL OF NURSING, KOC UNIVERSITY, STANBUL, TURKEY.; SCHOOL OF NURSING, KOC UNIVERSITY, STANBUL, TURKEY.; COLLEGE OF NURSING, UNIVERSITY OF MASSACHUSETTS AMHERST, MASSACHUSETTS, USA.;","ORCID: 0000-0001-9421-7689 ORCID: 0000-0003-2864-4935 ORCID: 0000-0003-2124-3311 ORCID: 0000-0003-1040-4044 ORCID: 0000-0002-6981-8877",NA,NA,NA,"2020/08/04 06:00","20211123","20200803",2021,"2020/08/04 06:00",NA,NA,"4-6","1096-4665 (ELECTRONIC) 0739-9332 (LINKING)","8411543","HEALTH CARE FOR WOMEN INTERNATIONAL","ENG","10.1080/07399332.2020.1797036 [DOI]","20211123","2021/11/24 06:00",NA,NA,NA,NA,"NLM","598-610","ENGLAND",NA,NA,"32744890","PPUBLISH","0 (TERATOGENS)",NA,NA,"HEALTH CARE WOMEN INT. 2021;42(4-6):598-610. DOI: 10.1080/07399332.2020.1797036. EPUB 2020 AUG 3.","MEDLINE","HEALTH CARE WOMEN INT","THE IMPACT OF PREGNANT WOMEN'S HEALTH LITERACY ON THEIR HEALTH-PROMOTING LIFESTYLE AND TERATOGENIC RISK PERCEPTION.",NA,"42","10.1080/07399332.2020.1797036","PUBMED","FEMALE;HEALTH KNOWLEDGE, ATTITUDES, PRACTICE;HEALTH LITERACY;HUMANS;LIFE STYLE;PERCEPTION;PREGNANCY;PREGNANT WOMEN;TERATOGENS",NA,0,"none","GIRESUN UNIVERSITY;BATMAN UNIVERSITY;MEDICALPARK HOSPITAL;KOC UNIVERSITY;KOC UNIVERSITY;UNIVERSITY OF MASSACHUSETTS AMHERST","GIRESUN UNIVERSITY;BATMAN UNIVERSITY;MEDICALPARK HOSPITAL;KOC UNIVERSITY;KOC UNIVERSITY;UNIVERSITY OF MASSACHUSETTS AMHERST",NA,"SAHIN E, 2021, HEALTH CARE WOMEN INT","SAHIN E, 2021, HEALTH CARE WOMEN INT"
"MUSCAT DM;LAMBERT K;SHEPHERD H;MCCAFFERY KJ;ZWI S;LIU N;SUD K;SAUNDERS J;O'LONE E;KIM J;ROBBINS A;WEBSTER AC","MUSCAT, DANIELLE MARIE;LAMBERT, KELLY;SHEPHERD, HEATHER;MCCAFFERY, KIRSTEN J;ZWI, STEPHANIE;LIU, NA;SUD, KAMAL;SAUNDERS, JOHN;O'LONE, EMMA;KIM, JINMAN;ROBBINS, APHRA;WEBSTER, ANGELA C","ADULT;AUSTRALIA;COMMUNICATION;HEALTH LITERACY;HUMANS;MOBILE APPLICATIONS;RENAL INSUFFICIENCY, CHRONIC/THERAPY","10.1002/HPJA.416 [DOI]","CHRONIC KIDNEY DISEASE;DIALYSIS;HEALTH LITERACY;SHARED DECISION-MAKING;SMARTPHONE APPLICATION","2020/03/31 00:00 [RECEIVED];2020/08/21 00:00 [ACCEPTED];2020/09/06 06:00 [PUBMED];2021/08/19 06:00 [MEDLINE];2020/09/05 05:21 [ENTREZ]","JOURNAL ARTICLE","ISSUE ADDRESSED: INADEQUATE HEALTH LITERACY IS COMMON IN THOSE WITH CHRONIC KIDNEY DISEASE (CKD), ESPECIALLY AMONG CULTURALLY AND LINGUISTICALLY DIVERSE GROUPS. PATIENT INFORMATION FOR PEOPLE WITH CKD, INCLUDING THOSE WITH KIDNEY FAILURE REQUIRING DIALYSIS, IS OFTEN WRITTEN BEYOND THEIR LITERACY LEVEL, AND MANY CKD-RELATED APPS ARE NOT ACCURATE OR EVIDENCE BASED. THESE REPRESENT IMPORTANT BARRIERS TO HEALTH CARE DECISION-MAKING AND EQUITY IN ACCESS TO HEALTH CARE. METHODS: WE DEVELOPED A CROSS-PLATFORM APPLICATION (THE \"SUCCESS APP\") TO SUPPORT AUSTRALIAN ADULTS WITH KIDNEY FAILURE REQUIRING DIALYSIS TO ACTIVELY PARTICIPATE IN SELF-MANAGEMENT AND DECISION-MAKING. APP CONTENT WAS INFORMED BY HEALTH LITERACY THEORY WHICH RECOGNISES THE IMPORTANCE OF REDUCING THE COMPLEXITY OF HEALTH INFORMATION AS WELL AS EQUIPPING CONSUMERS WITH THE SKILLS NECESSARY TO ACCESS, UNDERSTAND AND ACT ON THIS INFORMATION. THE DEVELOPMENT TEAM COMPRISED MEMBERS OF DIVERSE BACKGROUNDS AND EXPERTISE, INCLUDING NURSING, ALLIED HEALTH, PSYCHOLOGY, EPIDEMIOLOGY, NEPHROLOGY AND IT, AS WELL AS CONSUMER REPRESENTATIVES. RESULTS: CONTENT AREAS INCLUDED DIET, FLUIDS, MEDICINE, PHYSICAL ACTIVITY, EMOTIONAL WELL-BEING AND SUPPORTIVE CARE, CHOSEN AS THEY REPRESENT IMPORTANT DECISION POINTS IN THE CKD TRAJECTORY. TO SUPPORT FUNCTIONAL HEALTH LITERACY, A FOUR-STEP PROCESS TO SIMPLIFY WRITTEN CONTENT WAS USED INCLUDING CALCULATING READABILITY STATISTICS, APPLYING THE PATIENT EDUCATION MATERIALS ASSESSMENT TOOL, SUPPLEMENTING WRITTEN INFORMATION WITH VIDEO AND AUDIO CONTENT, AND INCORPORATING MICRO-LEARNING AND INTERACTIVE QUIZZES. TO DEVELOP COMMUNICATIVE AND CRITICAL HEALTH LITERACY SKILLS, QUESTION PROMPT LISTS AND EVIDENCE-BASED VOLITIONAL HELP SHEETS WERE INCLUDED IN EACH MODULE TO SUPPORT QUESTION-ASKING AND BEHAVIOUR CHANGE. WE ALSO DEVELOPED ANIMATED SKILLS TRAINING RELATED TO COMMUNICATION, SHARED DECISION-MAKING AND CRITICAL APPRAISAL OF HEALTH INFORMATION. CONCLUSIONS: THIS IS THE FIRST HEALTH LITERACY INFORMED APP DEVELOPED TO PROMOTE ACTIVE PATIENT PARTICIPATION IN CKD MANAGEMENT AND DECISION-MAKING. ONGOING EVALUATION OF THE SUCCESS APP THROUGH ANALYSIS OF QUANTITATIVE AND QUALITATIVE DATA WILL PROVIDE VALUABLE INSIGHTS INTO THE FEASIBILITY OF IMPLEMENTING THE APP WITH DIALYSIS PATIENTS, AND THE IMPACT OF THE INTERVENTION OF PSYCHOSOCIAL AND CLINICAL OUTCOMES. SO WHAT?: DIGITAL HEALTH SOLUTIONS HAVE BEEN FOUND TO IMPROVE SELF-MANAGEMENT FOR CHRONIC CONDITIONS, AND COULD OPTIMISE THE USE OF HEALTH CARE SERVICES AND PATIENT OUTCOMES.","SYDNEY HEALTH LITERACY LAB, SYDNEY SCHOOL OF PUBLIC HEALTH, FACULTY OF MEDICINE AND HEALTH, THE UNIVERSITY OF SYDNEY, SYDNEY, AUSTRALIA.; DISCIPLINE OF NUTRITION AND DIETETICS, FACULTY OF SCIENCE, MEDICINE AND HEALTH, SCHOOL OF MEDICINE, UNIVERSITY OF WOLLONGONG, WOLLONGONG, AUSTRALIA.; SCHOOL OF PSYCHOLOGY, FACULTY OF SCIENCE, THE UNIVERSITY OF SYDNEY, SYDNEY, AUSTRALIA.; SYDNEY HEALTH LITERACY LAB, SYDNEY SCHOOL OF PUBLIC HEALTH, FACULTY OF MEDICINE AND HEALTH, THE UNIVERSITY OF SYDNEY, SYDNEY, AUSTRALIA.; SYDNEY HEALTH LITERACY LAB, SYDNEY SCHOOL OF PUBLIC HEALTH, FACULTY OF MEDICINE AND HEALTH, THE UNIVERSITY OF SYDNEY, SYDNEY, AUSTRALIA.; SCHOOL OF COMPUTER SCIENCE, FACULTY OF ENGINEERING AND IT, THE UNIVERSITY OF SYDNEY, SYDNEY, AUSTRALIA.; NEPEAN CLINICAL SCHOOL, FACULTY OF MEDICINE AND HEALTH, THE UNIVERSITY OF SYDNEY, SYDNEY, AUSTRALIA.; DEPARTMENT OF RENAL MEDICINE, NEPEAN HOSPITAL, NEPEAN BLUE MOUNTAINS LOCAL HEALTH DISTRICT, SYDNEY, AUSTRALIA.; DEPARTMENT OF RENAL MEDICINE, ROYAL PRINCE ALFRED HOSPITAL, SYDNEY LOCAL HEALTH DISTRICT, SYDNEY, AUSTRALIA.; DEPARTMENT OF RENAL MEDICINE, ROYAL NORTH SHORE HOSPITAL, NORTHERN SYDNEY LOCAL HEALTH DISTRICT, SYDNEY, AUSTRALIA.; SCHOOL OF COMPUTER SCIENCE, FACULTY OF ENGINEERING AND IT, THE UNIVERSITY OF SYDNEY, SYDNEY, AUSTRALIA.; TELEHEALTH AND TECHNOLOGY CENTER, NEPEAN HOSPITAL, NEPEAN BLUE MOUNTAINS LOCAL HEALTH DISTRICT, SYDNEY, AUSTRALIA.; SYDNEY, AUSTRALIA.; SYDNEY SCHOOL OF PUBLIC HEALTH, FACULTY OF MEDICINE AND HEALTH, THE UNIVERSITY OF SYDNEY, SYDNEY, AUSTRALIA.;","ORCID: 0000-0001-6106-6298"," 2021 AUSTRALIAN HEALTH PROMOTION ASSOCIATION.",NA,NA,"2020/09/05 05:21","20210818","20201019",2021,"2020/09/06 06:00",NA,"KHA2018-AW/KIDNEY HEALTH AUSTRALIA/ SHP2018/0108-9/SYDNEY HEALTH PARTNERS/",NA,"1036-1073 (PRINT) 1036-1073 (LINKING)","9710936","HEALTH PROMOTION JOURNAL OF AUSTRALIA : OFFICIAL JOURNAL OF AUSTRALIAN ASSOCIATION OF HEALTH PROMOTION PROFESSIONALS","ENG","10.1002/HPJA.416 [DOI]","20210818","2021/08/19 06:00",NA,NA,NA,"NOTNLM","NLM","115-127","AUSTRALIA",NA,NA,"32888215","PPUBLISH",NA,"IM",NA,"HEALTH PROMOT J AUSTR. 2021 FEB;32 SUPPL 1:115-127. DOI: 10.1002/HPJA.416. EPUB 2020 OCT 19.","MEDLINE","HEALTH PROMOT J AUSTR","SUPPORTING PATIENTS TO BE INVOLVED IN DECISIONS ABOUT THEIR HEALTH AND CARE: DEVELOPMENT OF A BEST PRACTICE HEALTH LITERACY APP FOR AUSTRALIAN ADULTS LIVING WITH CHRONIC KIDNEY DISEASE.",NA,"32 SUPPL 1","10.1002/HPJA.416","PUBMED","ADULT;AUSTRALIA;COMMUNICATION;HEALTH LITERACY;HUMANS;MOBILE APPLICATIONS;RENAL INSUFFICIENCY, CHRONIC/THERAPY",NA,0,"none","THE UNIVERSITY OF SYDNEY;UNIVERSITY OF WOLLONGONG;THE UNIVERSITY OF SYDNEY;THE UNIVERSITY OF SYDNEY;THE UNIVERSITY OF SYDNEY;THE UNIVERSITY OF SYDNEY;THE UNIVERSITY OF SYDNEY;NEPEAN HOSPITAL;ROYAL PRINCE ALFRED HOSPITAL;ROYAL NORTH SHORE HOSPITAL;THE UNIVERSITY OF SYDNEY;TELEHEALTH AND TECHNOLOGY CENTER;THE UNIVERSITY OF SYDNEY","THE UNIVERSITY OF SYDNEY;UNIVERSITY OF WOLLONGONG;THE UNIVERSITY OF SYDNEY;THE UNIVERSITY OF SYDNEY;THE UNIVERSITY OF SYDNEY;THE UNIVERSITY OF SYDNEY;THE UNIVERSITY OF SYDNEY;NEPEAN HOSPITAL;ROYAL PRINCE ALFRED HOSPITAL;ROYAL NORTH SHORE HOSPITAL;THE UNIVERSITY OF SYDNEY;TELEHEALTH AND TECHNOLOGY CENTER;NOTREPORTED;THE UNIVERSITY OF SYDNEY",NA,"MUSCAT DM, 2021, HEALTH PROMOT J AUSTR","MUSCAT DM, 2021, HEALTH PROMOT J AUSTR"
"YEE LM;SILVER R;HAAS DM;PARRY S;MERCER BM;WING DA;REDDY U;SAADE GR;SIMHAN H;GROBMAN WA","YEE, LYNN M;SILVER, ROBERT;HAAS, DAVID M;PARRY, SAMUEL;MERCER, BRIAN M;WING, DEBORAH A;REDDY, UMA;SAADE, GEORGE R;SIMHAN, HYAGRIV;GROBMAN, WILLIAM A",NA,"2783674 [PII];ZOI210666 [PII];10.1001/JAMANETWORKOPEN.2021.22576 [DOI]",NA,"2021/09/01 12:32 [ENTREZ];2021/09/02 06:00 [PUBMED];2021/09/02 06:00 [MEDLINE]","JOURNAL ARTICLE;RESEARCH SUPPORT, N.I.H., EXTRAMURAL;RESEARCH SUPPORT, NON-U.S. GOV'T","IMPORTANCE: HEALTH LITERACY IS CONSIDERED AN IMPORTANT SOCIAL DETERMINANT OF HEALTH THAT MAY UNDERLIE MANY HEALTH DISPARITIES, BUT IT IS UNCLEAR WHETHER INADEQUATE HEALTH LITERACY AMONG PREGNANT INDIVIDUALS IS ASSOCIATED WITH ADVERSE MATERNAL AND NEONATAL OUTCOMES. OBJECTIVE: TO ASSESS THE ASSOCIATION BETWEEN MATERNAL HEALTH LITERACY AND MATERNAL AND NEONATAL OUTCOMES AMONG NULLIPAROUS INDIVIDUALS. DESIGN, SETTING, AND PARTICIPANTS: THIS WAS A SECONDARY ANALYSIS OF A LARGE, MULTICENTER COHORT STUDY OF 10038 NULLIPAROUS INDIVIDUALS IN THE US (2010-2013). PARTICIPANTS UNDERWENT 3 ANTENATAL STUDY VISITS AND HAD DETAILED MATERNAL AND NEONATAL DATA ABSTRACTED. DATA ANALYSIS WAS PERFORMED FROM JULY TO DECEMBER 2019. EXPOSURES: BETWEEN 16 AND 21 WEEKS OF GESTATION, HEALTH LITERACY WAS ASSESSED USING THE RAPID ESTIMATE OF ADULT LITERACY IN MEDICINE-SHORT FORM, A VALIDATED 7-ITEM WORD RECOGNITION TEST. IN ACCORDANCE WITH STANDARD SCORING, RESULTS WERE DICHOTOMIZED AS INADEQUATE VS ADEQUATE HEALTH LITERACY. MAIN OUTCOMES AND MEASURES: ON THE BASIS OF THEORETICAL CAUSAL PATHWAYS BETWEEN HEALTH LITERACY AND HEALTH OUTCOMES, A PRIORI MATERNAL AND NEONATAL OUTCOMES (DETERMINED VIA MEDICAL RECORDS) WERE SELECTED FOR THIS ANALYSIS. MULTIVARIABLE POISSON REGRESSION MODELS WERE CONSTRUCTED TO ESTIMATE THE ASSOCIATIONS BETWEEN HEALTH LITERACY AND OUTCOMES. SENSITIVITY ANALYSES IN WHICH EDUCATION WAS REMOVED FROM MODELS AND THAT EXCLUDED INDIVIDUALS WHO SPOKE ENGLISH AS A SECOND LANGUAGE WERE PERFORMED. RESULTS: OF 9341 PARTICIPANTS WHO COMPLETED THE RAPID ESTIMATE OF ADULT LITERACY IN MEDICINE-SHORT FORM, THE MEAN (SD) AGE WAS 27.0 (5.6) YEARS, AND 2540 (27.4%) HAD PUBLICLY FUNDED PRENATAL CARE. OVERALL, 1638 PARTICIPANTS (17.5%) HAD SCORES INDICATIVE OF INADEQUATE HEALTH LITERACY. PARTICIPANTS WITH INADEQUATE HEALTH LITERACY WERE MORE LIKELY TO BE YOUNGER (MEAN [SD] AGE, 22.9 [5.0] VS 27.9 [5.3] YEARS), HAVE LESS EDUCATIONAL ATTAINMENT (SOME COLLEGE EDUCATION OR GREATER, 1149 PARTICIPANTS [73.9%] VS 5279 PARTICIPANTS [94.5%]), HAVE PUBLICLY FUNDED INSURANCE (1008 PARTICIPANTS [62.2%] VS 1532 PARTICIPANTS [20.0%]), AND REPORT THEY WERE A MEMBER OF AN UNDERREPRESENTED RACIAL OR ETHNIC GROUP (NON-HISPANIC BLACK, 506 PARTICIPANTS [30.9%] VS 780 PARTICIPANTS [10.1%]; HISPANIC, 516 PARTICIPANTS [31.5%] VS 948 PARTICIPANTS [12.3%]) COMPARED WITH THOSE WITH ADEQUATE HEALTH LITERACY. PARTICIPANTS WHO HAD INADEQUATE HEALTH LITERACY HAD GREATER RISK OF CESAREAN DELIVERY (ADJUSTED RISK RATIO [ARR], 1.11; 95% CI, 1.01-1.23) AND MAJOR PERINEAL LACERATION (ARR, 1.44; 95% CI, 1.03-2.01). THE ADJUSTED RISKS OF SMALL-FOR-GESTATIONAL-AGE STATUS (ARR, 1.34; 95% CI, 1.14-1.58), LOW BIRTH WEIGHT (ARR, 1.33; 95% CI, 1.07-1.65), AND 5-MINUTE APGAR SCORE LESS THAN 4 (ARR, 2.78; 95% CI, 1.16-6.65) WERE GREATER FOR NEONATES BORN TO PARTICIPANTS WITH INADEQUATE HEALTH LITERACY. SENSITIVITY ANALYSES CONFIRMED THESE FINDINGS. CONCLUSIONS AND RELEVANCE: THESE FINDINGS SUGGEST THAT INADEQUATE MATERNAL HEALTH LITERACY IS ASSOCIATED WITH A VARIETY OF ADVERSE MATERNAL AND NEONATAL OUTCOMES.","DIVISION OF MATERNAL-FETAL MEDICINE, DEPARTMENT OF OBSTETRICS AND GYNECOLOGY, NORTHWESTERN UNIVERSITY FEINBERG SCHOOL OF MEDICINE, CHICAGO, ILLINOIS.; DIVISION OF MATERNAL-FETAL MEDICINE, DEPARTMENT OF OBSTETRICS AND GYNECOLOGY, THE UNIVERSITY OF UTAH, SALT LAKE CITY.; DEPARTMENT OF OBSTETRICS AND GYNECOLOGY, INDIANA UNIVERSITY SCHOOL OF MEDICINE, INDIANAPOLIS.; DIVISION OF MATERNAL-FETAL MEDICINE, DEPARTMENT OF OBSTETRICS AND GYNECOLOGY, PERELMAN SCHOOL OF MEDICINE, UNIVERSITY OF PENNSYLVANIA, PHILADELPHIA.; DEPARTMENT OF OBSTETRICS AND GYNECOLOGY, THE METROHEALTH SYSTEM, CASE WESTERN RESERVE UNIVERSITY, CLEVELAND, OHIO.; DIVISION OF MATERNAL-FETAL MEDICINE, DEPARTMENT OF OBSTETRICS AND GYNECOLOGY, UNIVERSITY OF CALIFORNIA, IRVINE.; DIVISION OF MATERNAL-FETAL MEDICINE, DEPARTMENT OF OBSTETRICS, GYNECOLOGY, AND REPRODUCTIVE SCIENCE, YALE UNIVERSITY, NEW HAVEN, CONNECTICUT.; DIVISION OF MATERNAL-FETAL MEDICINE, DEPARTMENT OF OBSTETRICS AND GYNECOLOGY, UNIVERSITY OF TEXAS MEDICAL BRANCH, GALVESTON.; DEPARTMENT OF OBSTETRICS, GYNECOLOGY, AND REPRODUCTIVE SCIENCE, UNIVERSITY OF PITTSBURGH SCHOOL OF MEDICINE, PITTSBURGH, PENNSYLVANIA.; DIVISION OF MATERNAL-FETAL MEDICINE, DEPARTMENT OF OBSTETRICS AND GYNECOLOGY, NORTHWESTERN UNIVERSITY FEINBERG SCHOOL OF MEDICINE, CHICAGO, ILLINOIS.;",NA,NA,"CONFLICT OF INTEREST DISCLOSURES: DR SIMHAN REPORTED BEING A COFOUNDER OF NAIMA HEALTH, LLC. NO OTHER DISCLOSURES WERE REPORTED.",NA,"2021/09/01 12:32",NA,"20210901",2021,"2021/09/02 06:00",NA,NA,"9","2574-3805 (ELECTRONIC) 2574-3805 (LINKING)","101729235","JAMA NETWORK OPEN","ENG","10.1001/JAMANETWORKOPEN.2021.22576 [DOI] E2122576","20211222","2021/09/02 06:00",NA,NA,NA,NA,"NLM","E2122576",NA,"PMC8411280",NA,"34468757","EPUBLISH",NA,"IM",NA,"JAMA NETW OPEN. 2021 SEP 1;4(9):E2122576. DOI: 10.1001/JAMANETWORKOPEN.2021.22576.","IN-PROCESS","JAMA NETW OPEN","ASSOCIATION OF HEALTH LITERACY AMONG NULLIPAROUS INDIVIDUALS AND MATERNAL AND NEONATAL OUTCOMES.",NA,"4","10.1001/JAMANETWORKOPEN.2021.22576","PUBMED",NA,NA,0,"none","NORTHWESTERN UNIVERSITY FEINBERG SCHOOL OF MEDICINE;THE UNIVERSITY OF UTAH;INDIANA UNIVERSITY SCHOOL OF MEDICINE;UNIVERSITY OF PENNSYLVANIA;CASE WESTERN RESERVE UNIVERSITY;UNIVERSITY OF CALIFORNIA;YALE UNIVERSITY;UNIVERSITY OF TEXAS MEDICAL BRANCH;UNIVERSITY OF PITTSBURGH SCHOOL OF MEDICINE;NORTHWESTERN UNIVERSITY FEINBERG SCHOOL OF MEDICINE","NORTHWESTERN UNIVERSITY FEINBERG SCHOOL OF MEDICINE;THE UNIVERSITY OF UTAH;INDIANA UNIVERSITY SCHOOL OF MEDICINE;UNIVERSITY OF PENNSYLVANIA;CASE WESTERN RESERVE UNIVERSITY;UNIVERSITY OF CALIFORNIA;YALE UNIVERSITY;UNIVERSITY OF TEXAS MEDICAL BRANCH;UNIVERSITY OF PITTSBURGH SCHOOL OF MEDICINE;NORTHWESTERN UNIVERSITY FEINBERG SCHOOL OF MEDICINE",NA,"YEE LM, 2021, JAMA NETW OPEN","YEE LM, 2021, JAMA NETW OPEN"
"TAMBLING RR;D'ANIELLO C;RUSSELL BS","TAMBLING, R R;D'ANIELLO, C;RUSSELL, B S",NA,"694 [PII];10.1007/S11469-021-00694-W [DOI]","BEHAVIORAL HEALTH DISPARITIES;HEALTH INSURANCE LITERACY;INTERNALIZED STIGMA;MENTAL HEALTH LITERACY;MENTAL ILLNESS","2021/10/21 00:00 [ACCEPTED];2021/11/17 06:53 [ENTREZ];2021/11/18 06:00 [PUBMED];2021/11/18 06:00 [MEDLINE]","JOURNAL ARTICLE","ONE OF THE MOST PERSISTENT AND TROUBLING HEALTH DISPARITIES IS THE UNDERUTILIZATION OF MENTAL HEALTH SERVICES, PARTICULARLY FOR DEPRESSION AND ANXIETY, COMMONLY OCCURRING BEHAVIORAL HEALTH CONCERNS. THE GAP BETWEEN INDIVIDUALS WHO NEED MENTAL HEALTH CARE AND THOSE WHO RECEIVE CARE IS LARGE, AND IDENTIFIED BARRIERS TO TREATMENT INCLUDE POOR MENTAL HEALTH AND INSURANCE LITERACY, AS WELL AS STIGMATIZING ATTITUDES TOWARD MENTAL HEALTH DISORDERS. THE PRESENT STUDY PRESENTS THE RESULTS OF AN INQUIRY INTO THE MENTAL HEALTH LITERACY, INSURANCE LITERACY, INTERNALIZED STIGMA, AND MENTAL HEALTH SYMPTOMS. RESULTS SUGGEST THAT MENTAL HEALTH LITERACY IS POOR AND ASSOCIATED WITH HIGHER RATES OF DEPRESSION, ANXIETY, STRESS, INTERNALIZED STIGMA, AND CAREGIVER BURDEN. IMPLICATIONS OF POOR MENTAL HEALTH LITERACY, AS WELL AS DEMOGRAPHIC DISPARITIES IN LITERACY, ARE DISCUSSED.","DEPARTMENT OF HUMAN DEVELOPMENT & FAMILY SCIENCES, UNIVERSITY OF CONNECTICUT, 348 MANSFIELD ROAD, UNIT 1058, STORRS, CT 06269-1058 USA.; GRID: GRID.;63054.;34.; ISNI: 0000 0001 0860 4915 DEPARTMENT OF COMMUNITY, FAMILY, AND ADDICTION SERVICES, TEXAS TECH UNIVERSITY, LUBBOCK, TX USA.; GRID: GRID.;264784.;B.; ISNI: 0000 0001 2186 7496 DEPARTMENT OF HUMAN DEVELOPMENT & FAMILY SCIENCES, UNIVERSITY OF CONNECTICUT, 348 MANSFIELD ROAD, UNIT 1058, STORRS, CT 06269-1058 USA.; GRID: GRID.;63054.;34.; ISNI: 0000 0001 0860 4915",NA," THE AUTHOR(S), UNDER EXCLUSIVE LICENCE TO SPRINGER SCIENCE+BUSINESS MEDIA, LLC, PART OF SPRINGER NATURE 2021.","CONFLICT OF INTERESTTHE AUTHORS HAVE NO POTENTIAL CONFLICTS OF INTEREST TO REPORT.",NA,"2021/11/17 06:53",NA,"20211111",2021,"2021/11/18 06:00",NA,NA,NA,"1557-1874 (PRINT) 1557-1882 (ELECTRONIC) 1557-1874 (LINKING)","101256588","INTERNATIONAL JOURNAL OF MENTAL HEALTH AND ADDICTION","ENG","10.1007/S11469-021-00694-W [DOI]","20211118","2021/11/18 06:00",NA,NA,NA,"NOTNLM","NLM","1-15",NA,"PMC8582339",NA,"34785992","AHEADOFPRINT",NA,NA,NA,"INT J MENT HEALTH ADDICT. 2021 NOV 11:1-15. DOI: 10.1007/S11469-021-00694-W.","PUBLISHER","INT J MENT HEALTH ADDICT","MENTAL HEALTH LITERACY: A CRITICAL TARGET FOR NARROWING RACIAL DISPARITIES IN BEHAVIORAL HEALTH.",NA,NA,"10.1007/S11469-021-00694-W","PUBMED",NA,NA,0,"none","UNIVERSITY OF CONNECTICUT;LUBBOCK;STORRS","UNIVERSITY OF CONNECTICUT;NOTREPORTED;NOTREPORTED;NOTREPORTED;TEXAS TECH UNIVERSITY;NOTREPORTED;NOTREPORTED;NOTREPORTED;UNIVERSITY OF CONNECTICUT;NOTREPORTED;NOTREPORTED;NOTREPORTED;NOTREPORTED",NA,"TAMBLING RR, 2021, INT J MENT HEALTH ADDICT","TAMBLING RR, 2021, INT J MENT HEALTH ADDICT"
"MARANGU E;MANSOURI F;SANDS N;NDETEI D;MURIITHI P;WYNTER K;RAWSON H","MARANGU, ELIJAH;MANSOURI, FETHI;SANDS, NATISHA;NDETEI, DAVID;MURIITHI, PETERSON;WYNTER, KAREN;RAWSON, HELEN",NA,"10.1186/S13033-021-00481-Z [PII];481 [PII];10.1186/S13033-021-00481-Z [DOI]","CAPACITY BUILDING;LOW AND MIDDLE-INCOME COUNTRIES;MENTAL HEALTH CARE;MENTAL HEALTH LITERACY;PRIMARY HEALTH CARE","2020/11/22 00:00 [RECEIVED];2021/05/25 00:00 [ACCEPTED];2021/06/02 05:39 [ENTREZ];2021/06/03 06:00 [PUBMED];2021/06/03 06:01 [MEDLINE]","JOURNAL ARTICLE","AIM: TO ASSESS MENTAL HEALTH LITERACY OF HEALTH WORKERS IN PRIMARY HEALTH CARE SERVICES IN KENYA. BACKGROUND: MENTAL ILLNESS IS COMMON IN KENYA, YET THERE ARE FEWER THAN 500 SPECIALIST MENTAL HEALTH WORKERS TO SERVE KENYA'S POPULATION OF OVER 50 MILLION. THE WORLD HEALTH ORGANIZATION RECOMMENDS THE INTEGRATION OF MENTAL HEALTH CARE INTO PRIMARY HEALTH CARE SERVICES TO IMPROVE ACCESS TO AND EQUITY OF THIS CARE, ESPECIALLY IN LOW AND MIDDLE-INCOME COUNTRIES. AN IMPORTANT STEP TO INTEGRATING MENTAL HEALTH CARE INTO PRIMARY HEALTH CARE SERVICES IS TO DETERMINE MENTAL HEALTH LITERACY LEVELS OF THE PRIMARY HEALTH CARE WORKFORCE. METHOD: A CROSS-SECTIONAL SURVEY USING JORM'S MENTAL HEALTH LITERACY INSTRUMENT (ADAPTED FOR THE KENYAN CONTEXT) WAS ADMINISTERED TO 310 PRIMARY HEALTH CARE WORKERS IN FOUR COUNTIES OF KENYA. RESULTS: OF THE 310 QUESTIONNAIRES DISTRIBUTED, 212 (68.3%) WERE RETURNED. OF THE RESPONDENTS, 13% HAD A FORMAL MENTAL HEALTH QUALIFICATION, WHILE ONLY 8.7% HAD RECEIVED RELEVANT CONTINUING PROFESSIONAL DEVELOPMENT IN THE FIVE YEARS PRECEDING THE SURVEY. JUST OVER ONE THIRD (35.6%) OF PRIMARY HEALTH CARE WORKERS COULD CORRECTLY IDENTIFY DEPRESSION, WITH EVEN FEWER RECOGNISING SCHIZOPHRENIA (15.7%). CONCLUSIONS: THIS STUDY PROVIDES PRELIMINARY INFORMATION ABOUT MENTAL HEALTH LITERACY AMONG PRIMARY HEALTH CARE WORKERS IN KENYA. THE MAJORITY OF RESPONDENTS HAD LOW MENTAL HEALTH LITERACY AS INDICATED BY THEIR INABILITY TO IDENTIFY COMMON MENTAL DISORDERS. WHILE IDENTIFYING GAPS IN PRIMARY HEALTH CARE WORKERS' MENTAL HEALTH KNOWLEDGE, THESE DATA HIGHLIGHT OPPORTUNITIES FOR CAPACITY BUILDING THAT CAN ENHANCE MENTAL HEALTH CARE IN KENYA AND SIMILAR LOW AND MIDDLE-INCOME COUNTRIES.","NATIONAL INDIGENOUS KNOWLEDGES EDUCATION RESEARCH INNOVATION (NIKERI) INSTITUTE, DEAKIN UNIVERSITY, 75 PIGDONS ROAD, WAURN PONDS, VIC, 3216, AUSTRALIA.; ELIJAHMARANGU@YAHOO.;COM.; INSTITUTE FOR CITIZENSHIP & GLOBALISATION, DEAKIN UNIVERSITY, BURWOOD CAMPUS, 221 BURWOOD HIGHWAY, BURWOOD, VIC, 3125, AUSTRALIA.; NURSE TALK PTY, MELBOURNE, AUSTRALIA.; DEPARTMENT OF PSYCHIATRY, NAIROBI UNIVERSITY, P.;O BOX 48423-00100, NAIROBI, KENYA.; SCHOOL OF POPULATION HEALTH, NAIROBI UNIVERSITY, P.;O BOX 19676-00202 KNH, NAIROBI, KENYA.; SCHOOL OF NURSING & MIDWIFERY, DEAKIN UNIVERSITY, BURWOOD CAMPUS.; BUILDING Y, 221 BURWOOD HIGHWAY, BURWOOD, VIC, 3125, AUSTRALIA.; NURSING & MIDWIFERY, MONASH UNIVERSITY, LEVEL 3, BUILDING 13D.; 35 RAINFOREST WALK, CLAYTON, VIC, 3800, AUSTRALIA.;","ORCID: 0000-0002-2874-0022",NA,"ALL AUTHORS DECLARE NO CONFLICT OF INTEREST IN WRITING AND SEEKING PUBLICATION FOR THIS PAPER.",NA,"2021/06/02 05:39",NA,"20210601",2021,"2021/06/03 06:00",NA,NA,"1","1752-4458 (PRINT) 1752-4458 (ELECTRONIC) 1752-4458 (LINKING)","101294224","INTERNATIONAL JOURNAL OF MENTAL HEALTH SYSTEMS","ENG","10.1186/S13033-021-00481-Z [DOI] 55","20210605","2021/06/03 06:01",NA,NA,NA,"NOTNLM","NLM","55",NA,"PMC8170792",NA,"34074318","EPUBLISH",NA,NA,NA,"INT J MENT HEALTH SYST. 2021 JUN 1;15(1):55. DOI: 10.1186/S13033-021-00481-Z.","PUBMED-NOT-MEDLINE","INT J MENT HEALTH SYST","ASSESSING MENTAL HEALTH LITERACY OF PRIMARY HEALTH CARE WORKERS IN KENYA: A CROSS-SECTIONAL SURVEY.",NA,"15","10.1186/S13033-021-00481-Z","PUBMED",NA,NA,0,"none","DEAKIN UNIVERSITY;DEAKIN UNIVERSITY;NAIROBI UNIVERSITY;NAIROBI UNIVERSITY;DEAKIN UNIVERSITY;MONASH UNIVERSITY;","DEAKIN UNIVERSITY;NOTREPORTED;NOTREPORTED;DEAKIN UNIVERSITY;NOTREPORTED;NAIROBI UNIVERSITY;NOTREPORTED;NAIROBI UNIVERSITY;NOTREPORTED;DEAKIN UNIVERSITY;NOTREPORTED;MONASH UNIVERSITY;NOTDECLARED",NA,"MARANGU E, 2021, INT J MENT HEALTH SYST","MARANGU E, 2021, INT J MENT HEALTH SYST"
