"AU","AF","DE","AID","OT","PHST","DT","AB","C1","OI","CI","COIS","CON","CRDT","DCOM","DEP","PY","EDAT","EIN","GR","IS","SN","JID","SO","LA","LID","LR","MHDA","MID","OAB","OABL","OTO","OWN","PP","PL","PMC","PMCR","PMID","PST","RN","SB","SI","SO2","STAT","J9","TI","TT","VL","DI","DB","ID","RP","TC","CR","AU_UN","AU1_UN","AU_UN_NR","SR_FULL","SR"
"MUSCAT DM;CEPRNJA D;HOBBS K;GIBSON JA;BLUMENTHAL C;MILAD R;BURNS C;LAU T;FLOOD V","MUSCAT, DANIELLE M;CEPRNJA, DRAGANA;HOBBS, KIM;GIBSON, JODI-ANNE;BLUMENTHAL, CARON;MILAD, RULA;BURNS, CHRIS;LAU, TIMOTHEA;FLOOD, VICTORIA","ALLIED HEALTH PERSONNEL;DATA COLLECTION;HEALTH LITERACY;HUMANS;PROGRAM EVALUATION;STUDENTS","10.1002/HPJA.350 [DOI]","ALLIED HEALTH;HEALTH LITERACY;TEACH-BACK;TRAIN-THE-TRAINER;TRAINING PROGRAM","2020/03/06 00:00 [RECEIVED];2020/04/16 00:00 [ACCEPTED];2020/04/23 06:00 [PUBMED];2021/08/19 06:00 [MEDLINE];2020/04/23 06:00 [ENTREZ]","JOURNAL ARTICLE","ISSUE ADDRESSED: WE DEVELOPED AND EVALUATED A HEALTH LITERACY TRAINING PROGRAM FOR ALLIED HEALTH PROFESSIONALS, AND EXPLORED THE FEASIBILITY OF A TRAIN-THE-TRAINER MODEL TO SUPPORT DISSEMINATION. METHODS: THE PROGRAM COMBINED DIDACTIC AND EXPERIENTIAL TEACHING METHODS AND BEHAVIOUR CHANGE TECHNIQUES, WITH A FOCUS ON TEACH-BACK AND DEVELOPING EASY-TO-UNDERSTAND WRITTEN MATERIALS. OUTCOMES INCLUDED PARTICIPANT REACTIONS, CONFIDENCE (RANGE: 6-30), BEHAVIOURAL INTENTIONS (RANGE: 6-42), AND DISSEMINATION OF TRAINING CONTENT. IMPLEMENTATION OUTCOMES WERE EVALUATED USING THE NORMALIZATION MEASURE DEVELOPMENT (NOMAD) TOOL, ASSESSING THE CONSTRUCTS OF COHERENCE (RANGE: 4-20), COGNITIVE PARTICIPATION (RANGE: 4-20), COLLECTIVE ACTION (RANGE: 7-35) AND REFLEXIVE MONITORING (RANGE: 5-25). RESULTS: OF THE 29 ALLIED HEALTH PROFESSIONALS WHO PARTICIPATED, 90% RATED THE PROGRAM AS 'EXCELLENT'/'VERY GOOD', AND 97% SAID THE INFORMATION WAS 'EXTREMELY'/'VERY' HELPFUL FOR THEIR EVERYDAY PRACTICE. WE OBSERVED INCREASES IN CONFIDENCE (MEAN DIFFERENCE [MD]=6.3, STANDARD DEVIATION [SD]=2.7, T(25) =11.87, P<.001) AND INTENTIONS (MD=3.6, SD=8.1, T(23) =2.2, P=.04) RELATED TO HEALTH LITERACY PRACTICES AFTER 6WEEKS. IMPROVED CONFIDENCE WAS RETAINED OVER 6MONTHS (MD=7.1, SD=5.2, T(18) =5.96, P<.001). AFTER 6MONTHS, 95% OF PARTICIPANTS (N=19) REPORTED USING TEACH-BACK AND 50% (N=10) REPORTED HAVING USED A READABILITY FORMULA. EIGHT-FIVE PER CENT OF PARTICIPANTS (17/20) HAD TRAINED OTHERS IN HEALTH LITERACY, REACHING N=201 ALLIED HEALTH PROFESSIONALS AND STUDENTS. NOMAD SCORES WERE HIGHEST IN RELATION TO COGNITIVE PARTICIPATION (/20) (M=18.2, SD=2.1) AND LOWEST IN RELATION TO COLLECTIVE ACTION (/35) (M=25.4, SD=3.0). CONCLUSIONS: A TRAIN-THE-TRAINER MODEL APPEARS TO BE A FEASIBLE METHOD TO DISSEMINATE HEALTH LITERACY TRAINING, BUT ADDITIONAL WORK MAY BE NEEDED TO IMPROVE THE COLLECTIVE WORK DONE TO ENABLE HEALTH LITERACY PRACTICES IN REAL-WORLD CLINICAL CONTEXTS. SO WHAT: STAFF TRAINING IS PARTICULARLY IMPORTANT IN HIGHLY DIVERSE AREAS WHERE PATIENTS ARE DISPROPORTIONATELY AFFECTED BY LOW HEALTH LITERACY.","SYDNEY HEALTH LITERACY LAB, SYDNEY SCHOOL OF PUBLIC HEALTH, FACULTY OF MEDICINE AND HEALTH, UNIVERSITY OF SYDNEY, SYDNEY, AUSTRALIA.; WESTERN SYDNEY LOCAL HEALTH DISTRICT, SYDNEY, AUSTRALIA.; WESTERN SYDNEY LOCAL HEALTH DISTRICT, SYDNEY, AUSTRALIA.; WESTERN SYDNEY LOCAL HEALTH DISTRICT, SYDNEY, AUSTRALIA.; WESTERN SYDNEY LOCAL HEALTH DISTRICT, SYDNEY, AUSTRALIA.; WESTERN SYDNEY LOCAL HEALTH DISTRICT, SYDNEY, AUSTRALIA.; WESTERN SYDNEY LOCAL HEALTH DISTRICT, SYDNEY, AUSTRALIA.; WESTERN SYDNEY LOCAL HEALTH DISTRICT, SYDNEY, AUSTRALIA.; WESTERN SYDNEY LOCAL HEALTH DISTRICT, SYDNEY, AUSTRALIA.; SYDNEY SCHOOL OF HEALTH SCIENCES, FACULTY OF MEDICINE AND HEALTH, UNIVERSITY OF SYDNEY, SYDNEY, AUSTRALIA.;","ORCID: 0000-0001-6106-6298 ORCID: 0000-0003-0442-8787"," 2021 AUSTRALIAN HEALTH PROMOTION ASSOCIATION.",NA,NA,"2020/04/23 06:00","20210818","20200526",2021,"2020/04/23 06:00",NA,"WPL18-00036/HEALTH EDUCATION AND TRAINING INSTITUTE/",NA,"1036-1073 (PRINT) 1036-1073 (LINKING)","9710936","HEALTH PROMOTION JOURNAL OF AUSTRALIA : OFFICIAL JOURNAL OF AUSTRALIAN ASSOCIATION OF HEALTH PROMOTION PROFESSIONALS","ENG","10.1002/HPJA.350 [DOI]","20210818","2021/08/19 06:00",NA,NA,NA,"NOTNLM","NLM","88-97","AUSTRALIA",NA,NA,"32320505","PPUBLISH",NA,"IM",NA,"HEALTH PROMOT J AUSTR. 2021 FEB;32 SUPPL 1:88-97. DOI: 10.1002/HPJA.350. EPUB 2020 MAY 26.","MEDLINE","HEALTH PROMOT J AUSTR","DEVELOPMENT AND EVALUATION OF A HEALTH LITERACY TRAINING PROGRAM FOR ALLIED HEALTH PROFESSIONALS: A PRE-POST STUDY ASSESSING IMPACT AND IMPLEMENTATION OUTCOMES.",NA,"32 SUPPL 1","10.1002/HPJA.350","PUBMED","ALLIED HEALTH PERSONNEL;DATA COLLECTION;HEALTH LITERACY;HUMANS;PROGRAM EVALUATION;STUDENTS",NA,0,"none","UNIVERSITY OF SYDNEY;WESTERN SYDNEY LOCAL HEALTH DISTRICT;WESTERN SYDNEY LOCAL HEALTH DISTRICT;WESTERN SYDNEY LOCAL HEALTH DISTRICT;WESTERN SYDNEY LOCAL HEALTH DISTRICT;WESTERN SYDNEY LOCAL HEALTH DISTRICT;WESTERN SYDNEY LOCAL HEALTH DISTRICT;WESTERN SYDNEY LOCAL HEALTH DISTRICT;WESTERN SYDNEY LOCAL HEALTH DISTRICT;UNIVERSITY OF SYDNEY","UNIVERSITY OF SYDNEY;WESTERN SYDNEY LOCAL HEALTH DISTRICT;WESTERN SYDNEY LOCAL HEALTH DISTRICT;WESTERN SYDNEY LOCAL HEALTH DISTRICT;WESTERN SYDNEY LOCAL HEALTH DISTRICT;WESTERN SYDNEY LOCAL HEALTH DISTRICT;WESTERN SYDNEY LOCAL HEALTH DISTRICT;WESTERN SYDNEY LOCAL HEALTH DISTRICT;WESTERN SYDNEY LOCAL HEALTH DISTRICT;UNIVERSITY OF SYDNEY",NA,"MUSCAT DM, 2021, HEALTH PROMOT J AUSTR","MUSCAT DM, 2021, HEALTH PROMOT J AUSTR-a"
"YOU X;LIU Y;ZHANG M;ZHANG M;YU Y;SANG C","YOU, XUEMEI;LIU, YONGDONG;ZHANG, MINGMING;ZHANG, MAN;YU, YANGLI;SANG, CHENGGE","HEALTH LITERACY;HEALTH STATUS;HUMANS","10.1155/2021/7049997 [DOI]",NA,"2021/09/29 00:00 [RECEIVED];2021/10/18 00:00 [ACCEPTED];2021/12/17 06:53 [ENTREZ];2021/12/18 06:00 [PUBMED];2021/12/21 06:00 [MEDLINE]","JOURNAL ARTICLE","NOWADAYS, THE HEALTH LEVEL OF RESIDENTS HAS BECOME THE FOCUS OF PEOPLE'S ATTENTION. UNDER THE BACKGROUND OF THE DEVELOPMENT OF HEALTH SERVICE FROM \"DISEASE-CENTERED\" TO \"HEALTH-CENTERED,\" IT IS VERY IMPORTANT TO IMPROVE THE LEVEL OF URBAN HEALTH AND CLARIFY THE FACTORS AFFECTING URBAN HEALTH. THEREFORE, THIS PAPER QUANTIFIES THE RELATIONSHIP BETWEEN RESIDENTS' HEALTH LITERACY LEVEL AND ENVIRONMENT, AVERAGE LIFE EXPECTANCY, INFECTIOUS DISEASE MORTALITY, AND OTHER INDICATORS BY SELECTING APPROPRIATE INDICATORS AND ESTABLISHING A MATHEMATICAL MODEL. BASED ON THE RECIPROCAL LINEAR COMBINATION OF THE COLLECTED INDEX DATA AND THE CORRESPONDING HEALTH LEVEL VALUE, THE PREDICTION MODEL OF SOCIAL HEALTH LITERACY LEVEL (SPM) WAS ESTABLISHED, AND THE QUALITATIVE PREDICTION AND QUANTITATIVE ANALYSIS OF CITIZENS' HEALTH LITERACY LEVEL WERE STUDIED IN DEPTH. BASED ON THE SPM MODEL, WE CAN ROUGHLY PREDICT THE LEVEL OF HEALTH LITERACY IN A REGION ONLY BASED ON THE MAIN VARIABLES IDENTIFIED IN THIS PAPER. THE CONSISTENCY OF THE EXPERIMENT SHOWS THAT THE MODEL IS EFFECTIVE AND ROBUST, AND IT REVEALS THAT ENVIRONMENTAL FACTORS ARE THE MOST IMPORTANT FACTORS AFFECTING RESIDENTS' HEALTH LITERACY LEVEL. THE ACTUAL DATA SHOW THAT THE SPM MODEL IS A TIMELY AND REASONABLE FRAMEWORK TO MEASURE THE HEALTH LITERACY LEVEL OF RESIDENTS.","BUSINESS SCHOOL, SHANDONG NORMAL UNIVERSITY, JINAN, SHANDONG 250014, CHINA.; BUSINESS SCHOOL, SHANDONG NORMAL UNIVERSITY, JINAN, SHANDONG 250014, CHINA.; BUSINESS SCHOOL, SHANDONG NORMAL UNIVERSITY, JINAN, SHANDONG 250014, CHINA.; BUSINESS SCHOOL, SHANDONG NORMAL UNIVERSITY, JINAN, SHANDONG 250014, CHINA.; BUSINESS SCHOOL, SHANDONG NORMAL UNIVERSITY, JINAN, SHANDONG 250014, CHINA.; BUSINESS SCHOOL, SHANDONG NORMAL UNIVERSITY, JINAN, SHANDONG 250014, CHINA.;","ORCID: 0000-0002-7704-1703","COPYRIGHT 2021 XUEMEI YOU ET AL.","THE AUTHORS DECLARE THAT THEY HAVE NO CONFLICTS OF INTEREST.",NA,"2021/12/17 06:53","20211220","20211207",2021,"2021/12/18 06:00",NA,NA,NA,"1687-5273 (ELECTRONIC) 1687-5265 (PRINT)","101279357","COMPUTATIONAL INTELLIGENCE AND NEUROSCIENCE","ENG","10.1155/2021/7049997 [DOI] 7049997","20211220","2021/12/21 06:00",NA,NA,NA,NA,"NLM","7049997",NA,"PMC8670972",NA,"34917138","EPUBLISH",NA,"IM",NA,"COMPUT INTELL NEUROSCI. 2021 DEC 7;2021:7049997. DOI: 10.1155/2021/7049997. ECOLLECTION 2021.","MEDLINE","COMPUT INTELL NEUROSCI","MODELING ON SOCIAL HEALTH LITERACY LEVEL PREDICTION.",NA,"2021","10.1155/2021/7049997","PUBMED","HEALTH LITERACY;HEALTH STATUS;HUMANS",NA,0,"none","SHANDONG NORMAL UNIVERSITY;SHANDONG NORMAL UNIVERSITY;SHANDONG NORMAL UNIVERSITY;SHANDONG NORMAL UNIVERSITY;SHANDONG NORMAL UNIVERSITY;SHANDONG NORMAL UNIVERSITY","SHANDONG NORMAL UNIVERSITY;SHANDONG NORMAL UNIVERSITY;SHANDONG NORMAL UNIVERSITY;SHANDONG NORMAL UNIVERSITY;SHANDONG NORMAL UNIVERSITY;SHANDONG NORMAL UNIVERSITY",NA,"YOU X, 2021, COMPUT INTELL NEUROSCI","YOU X, 2021, COMPUT INTELL NEUROSCI"
"SCHILLINGER D","SCHILLINGER, DEAN",NA,"10.3928/24748307-20210712-01 [DOI]",NA,"2021/08/11 17:15 [ENTREZ];2021/08/12 06:00 [PUBMED];2021/08/12 06:00 [MEDLINE]","JOURNAL ARTICLE","THIS ARTICLE SYNTHESIZES WHAT IS KNOWN ABOUT THE RELATIONSHIP BETWEEN SOCIAL DISADVANTAGE AND MEASURES OF HEALTH LITERACY (HL), AND REVIEWS THE RESEARCH EXAMINING WHETHER LOW HL IS AN EXPLANATORY FACTOR CONNECTING SOCIAL DISADVANTAGE, HEALTH OUTCOMES, AND HEALTH DISPARITIES. WRITTEN FROM A UNITED STATES PERSPECTIVE, THIS ARTICLE OFFERS A NOVEL CONCEPTUAL FRAMEWORK THAT PRESENTS HOW THE SOCIAL DETERMINANTS OF HEALTH MIGHT INTERACT WITH HL TO RESULT IN HEALTH DISPARITIES. THE FRAMEWORK ARTICULATES RELATIONSHIPS THAT REFLECT PUBLIC HEALTH PATHWAYS AND HEALTH CARE PATHWAYS, WHICH INCLUDE THEIR RELATED HEALTH LITERACIES. THE ARTICLE CONTINUES WITH SEVERAL CAUTIONARY STATEMENTS BASED ON THE INHERENT LIMITATIONS OF CURRENT HL RESEARCH, INCLUDING PROBLEMS AND CONCERNS SPECIFIC TO THE ATTRIBUTION OF HL AS AN EXPLANATORY FACTOR FOR EXTANT SOCIOECONOMIC AND RACIAL/ETHNIC HEALTH DISPARITIES. THE ARTICLE CLOSES WITH RECOMMENDATIONS REGARDING FUTURE RESEARCH DIRECTIONS. [HLRP: HEALTH LITERACY RESEARCH AND PRACTICE. 2021;5(3):E233-E243.] PLAIN LANGUAGE SUMMARY: SOCIALLY DISADVANTAGED POPULATIONS HAVE WORSE HEALTH AND HEALTH LITERACY COMPARED TO PRIVILEGED POPULATIONS. SCIENTISTS, HEALTH CARE PROVIDERS, AND POLICYMAKERS ARE INTERESTED IN THE POSSIBLE ROLE HEALTH LITERACY PLAYS IN EXPLAINING HEALTH DIFFERENCES. THE ARTICLE REVIEWS OUR CURRENT UNDERSTANDINGS OF WHETHER AND HOW POPULATION CHARACTERISTICS AND RELATED EXPOSURES TO RISK INTERACT WITH LOW HEALTH LITERACY TO GENERATE WORSE HEALTH TO INFORM INTERVENTIONS.",NA,NA,NA,NA,NA,"2021/08/11 17:15",NA,"20210807",2021,"2021/08/12 06:00",NA,NA,"3","2474-8307 (ELECTRONIC) 2475-6024 (PRINT) 2474-8307 (LINKING)","101712185","HEALTH LITERACY RESEARCH AND PRACTICE","ENG","10.3928/24748307-20210712-01 [DOI]","20210814","2021/08/12 06:00",NA,NA,NA,NA,"NLM","E234-E243",NA,"PMC8356483",NA,"34379549","PPUBLISH",NA,"IM",NA,"HEALTH LIT RES PRACT. 2021 JUL;5(3):E234-E243. DOI: 10.3928/24748307-20210712-01. EPUB 2021 AUG 7.","IN-DATA-REVIEW","HEALTH LIT RES PRACT","SOCIAL DETERMINANTS, HEALTH LITERACY, AND DISPARITIES: INTERSECTIONS AND CONTROVERSIES.",NA,"5","10.3928/24748307-20210712-01","PUBMED",NA,NA,0,"none",NA,"NOTREPORTED",NA,"SCHILLINGER D, 2021, HEALTH LIT RES PRACT","SCHILLINGER D, 2021, HEALTH LIT RES PRACT"
"LEMLEY SM;CASTRO-DIAZ S;CUBILLOS L;SUREZ-OBANDO F;TORREY WC;URIBE-RESTREPO JM;WILLIAMS M;MARSCH LA;GMEZ-RESTREPO C","LEMLEY, SHEA M;CASTRO-DIAZ, SERGIO;CUBILLOS, LEONARDO;SUREZ-OBANDO, FERNANDO;TORREY, WILLIAM C;URIBE-RESTREPO, JOS MIGUEL;WILLIAMS, MAKEDA;MARSCH, LISA A;GMEZ-RESTREPO, CARLOS","ADULT;COLOMBIA;HEALTH LITERACY;HUMANS;INSURANCE, HEALTH;PRIMARY HEALTH CARE;QUALITY OF LIFE","S2530-3120(21)00059-X [PII];10.1016/J.RCPENG.2021.06.005 [DOI]","ALFABETIZACIN EN SALUD;ATENCIN PRIMARIA;CALIDAD DE VIDA;HEALTH LITERACY;PRIMARY CARE;QUALITY OF LIFE","2021/07/14 06:00 [PUBMED];2021/10/29 06:00 [MEDLINE];2021/07/13 05:46 [ENTREZ]","JOURNAL ARTICLE","CONTEXT: COLOMBIA PASSED LAW 100 IN 1993 WITH THE GOAL OF PROVIDING UNIVERSAL HEALTH CARE COVERAGE, AND BY 2013, OVER 96% OF THE COLOMBIAN POPULATION HAD HEALTH INSURANCE COVERAGE. HOWEVER, LITTLE IS KNOWN ABOUT HOW HEALTH-RELATED QUALITY OF LIFE (HRQOL) AND HEALTH LITERACY ARE RELATED AMONG THOSE WITH THE TWO MOST COMMON TYPES OF HEALTH INSURANCE COVERAGE: SUBSIDIZED (THOSE WITH LOWER INCOMES) AND CONTRIBUTORY (THOSE WITH HIGHER INCOMES) COVERAGE. OBJECTIVES AND METHODS: IN THE CURRENT EXPLORATORY INVESTIGATION, DATA FROM ADULTS VISITING SIX PRIMARY CARE CLINICS IN COLOMBIA WERE ANALYSED TO EXAMINE THE RELATIONSHIP BETWEEN HRQOL (ASSESSED AS PROBLEMS WITH MOBILITY, SELF-CARE, COMPLETING USUAL ACTIVITIES, PAIN/DISCOMFORT, AND ANXIETY/DEPRESSION), DEMOGRAPHICS, THE TWO HEALTH INSURANCE TYPES, AND HEALTH LITERACY. ANALYSES ALSO ASSESSED WHETHER, WITHIN INSURANCE TYPES, HEALTH LITERACY WAS RELATED TO HRQOL. RESULTS: RESULTS SHOWED THAT THOSE WITH CONTRIBUTORY HEALTH INSURANCE COVERAGE HAD GREATER HEALTH LITERACY THAN THOSE WITH SUBSIDIZED COVERAGE, AND THIS WAS ACCOUNTED FOR BY DIFFERENCES IN EDUCATION AND SOCIOECONOMIC STATUS. HRQOL DID NOT DIFFER BY INSURANCE TYPE. ALTHOUGH LOWER HEALTH LITERACY WAS RELATED TO WORSE HRQOL IN THE OVERALL SAMPLE, IN SUBGROUP ANALYSES LOWER HEALTH LITERACY SIGNIFICANTLY RELATED TO WORSE HRQOL ONLY AMONG THOSE WITH SUBSIDIZED HEALTH INSURANCE COVERAGE. CONCLUSION: TARGETING SKILLS WHICH CONTRIBUTE TO HEALTH LITERACY, SUCH AS INTERPRETING MEDICAL INFORMATION OR FILLING OUT FORMS, MAY IMPROVE HRQOL, PARTICULARLY IN THOSE WITH SUBSIDIZED INSURANCE COVERAGE.","CENTER FOR TECHNOLOGY AND BEHAVIORAL HEALTH, GEISEL SCHOOL OF MEDICINE AT DARTMOUTH, NEW HAMPSHIRE, UNITED STATES.; ELECTRONIC ADDRESS: SMLEMLEY@GMAIL.;COM.; DEPARTAMENTO DE EPIDEMIOLOGA CLNICA Y BIOESTADSTICA, PONTIFICIA UNIVERSIDAD JAVERIANA, BOGOT, COLOMBIA.; CENTER FOR TECHNOLOGY AND BEHAVIORAL HEALTH, GEISEL SCHOOL OF MEDICINE AT DARTMOUTH, NEW HAMPSHIRE, UNITED STATES; DEPARTMENT OF PSYCHIATRY, GEISEL SCHOOL OF MEDICINE AT DARTMOUTH, NEW HAMPSHIRE, UNITED STATES.; DEPARTAMENTO DE EPIDEMIOLOGA CLNICA Y BIOESTADSTICA, PONTIFICIA UNIVERSIDAD JAVERIANA, BOGOT, COLOMBIA.; CENTER FOR TECHNOLOGY AND BEHAVIORAL HEALTH, GEISEL SCHOOL OF MEDICINE AT DARTMOUTH, NEW HAMPSHIRE, UNITED STATES; DEPARTMENT OF PSYCHIATRY, GEISEL SCHOOL OF MEDICINE AT DARTMOUTH, NEW HAMPSHIRE, UNITED STATES.; DEPARTAMENTO DE PSIQUIATRA Y SALUD MENTAL, PONTIFICIA UNIVERSIDAD JAVERIANA, COLOMBIA.; CENTER FOR TRANSLATION RESEARCH AND IMPLEMENTATION SCIENCE, NATIONAL HEART, LUNG, AND BLOOD INSTITUTE, NATIONAL INSTITUTES OF HEALTH, BETHESDA, MARYLAND, UNITED STATES.; CENTER FOR TECHNOLOGY AND BEHAVIORAL HEALTH, GEISEL SCHOOL OF MEDICINE AT DARTMOUTH, NEW HAMPSHIRE, UNITED STATES; DEPARTMENT OF PSYCHIATRY, GEISEL SCHOOL OF MEDICINE AT DARTMOUTH, NEW HAMPSHIRE, UNITED STATES.; DEPARTAMENTO DE EPIDEMIOLOGA CLNICA Y BIOESTADSTICA, PONTIFICIA UNIVERSIDAD JAVERIANA, BOGOT, COLOMBIA; DEPARTAMENTO DE PSIQUIATRA Y SALUD MENTAL, PONTIFICIA UNIVERSIDAD JAVERIANA, COLOMBIA; HOSPITAL UNIVERSITARIO SAN IGNACIO, BOGOT, COLOMBIA.;",NA,"COPYRIGHT 2021. PUBLISHED BY ELSEVIER ESPAA, S.L.U.","CONFLICTS OF INTEREST AUTHORS REPORT NOT HAVING ANY CONFLICTS OF INTEREST. DR. LISA A. MARSCH, ONE OF THE PRINCIPAL INVESTIGATORS ON THIS PROJECT, IS AFFILIATED WITH THE BUSINESS THAT DEVELOPED THE MOBILE INTERVENTION PLATFORM THAT IS BEING USED IN THIS RESEARCH. THIS RELATIONSHIP IS EXTENSIVELY MANAGED BY DR. MARSCH AND HER ACADEMIC INSTITUTION.",NA,"2021/07/13 05:46","20211028","20210709",2021,"2021/07/14 06:00",NA,"P30 DA029926/DA/NIDA NIH HHS/UNITED STATES U19 MH109988/MH/NIMH NIH HHS/UNITED STATES","SUPPL 1","2530-3120 (ELECTRONIC) 2530-3120 (LINKING)","101778593","REVISTA COLOMBIANA DE PSIQUIATRIA (ENGLISH ED.)","ENG SPA","S2530-3120(21)00059-X [PII] 10.1016/J.RCPENG.2021.06.005 [DOI]","20211214","2021/10/29 06:00","NIHMS1754849","PUBLISHER: ABSTRACT AVAILABLE FROM THE PUBLISHER.","SPA","NOTNLM","NLM","22-29",NA,"PMC8666104",NA,"34253502","PPUBLISH",NA,"IM",NA,"REV COLOMB PSIQUIATR (ENGL ED). 2021 JUL;50 SUPPL 1(SUPPL 1):22-29. DOI: 10.1016/J.RCPENG.2021.06.005. EPUB 2021 JUL 9.","MEDLINE","REV COLOMB PSIQUIATR (ENGL ED)","HEALTH-RELATED QUALITY OF LIFE AND HEALTH LITERACY AMONG ADULT PRIMARY CARE PATIENTS WITH SUBSIDIZED OR CONTRIBUTIVE HEALTH INSURANCE IN COLOMBIA.",NA,"50 SUPPL 1","S2530-3120(21)00059-X","PUBMED","ADULT;COLOMBIA;HEALTH LITERACY;HUMANS;INSURANCE, HEALTH;PRIMARY HEALTH CARE;QUALITY OF LIFE",NA,0,"none","GEISEL SCHOOL OF MEDICINE AT DARTMOUTH;ELECTRONIC ADDRESS: SMLEMLEY@GMAIL.;PONTIFICIA UNIVERSIDAD JAVERIANA;GEISEL SCHOOL OF MEDICINE AT DARTMOUTH;GEISEL SCHOOL OF MEDICINE AT DARTMOUTH;PONTIFICIA UNIVERSIDAD JAVERIANA;GEISEL SCHOOL OF MEDICINE AT DARTMOUTH;GEISEL SCHOOL OF MEDICINE AT DARTMOUTH;PONTIFICIA UNIVERSIDAD JAVERIANA;AND BLOOD INSTITUTE;GEISEL SCHOOL OF MEDICINE AT DARTMOUTH;GEISEL SCHOOL OF MEDICINE AT DARTMOUTH;PONTIFICIA UNIVERSIDAD JAVERIANA;PONTIFICIA UNIVERSIDAD JAVERIANA;HOSPITAL UNIVERSITARIO SAN IGNACIO","GEISEL SCHOOL OF MEDICINE AT DARTMOUTH;ELECTRONIC ADDRESS: SMLEMLEY@GMAIL.;NOTREPORTED;PONTIFICIA UNIVERSIDAD JAVERIANA;GEISEL SCHOOL OF MEDICINE AT DARTMOUTH;GEISEL SCHOOL OF MEDICINE AT DARTMOUTH;PONTIFICIA UNIVERSIDAD JAVERIANA;GEISEL SCHOOL OF MEDICINE AT DARTMOUTH;GEISEL SCHOOL OF MEDICINE AT DARTMOUTH;PONTIFICIA UNIVERSIDAD JAVERIANA;AND BLOOD INSTITUTE;GEISEL SCHOOL OF MEDICINE AT DARTMOUTH;GEISEL SCHOOL OF MEDICINE AT DARTMOUTH;PONTIFICIA UNIVERSIDAD JAVERIANA;PONTIFICIA UNIVERSIDAD JAVERIANA;HOSPITAL UNIVERSITARIO SAN IGNACIO",NA,"LEMLEY SM, 2021, REV COLOMB PSIQUIATR (ENGL ED)","LEMLEY SM, 2021, REV COLOMB PSIQUIATR (ENGL ED)"
"LEE M;LEE MA;AHN H;KO J;YON E;LEE J;KIM M;BRADEN CJ","LEE, MOONJU;LEE, MIKYOUNG A;AHN, HYOCHOL;KO, JISOOK;YON, ESTHER;LEE, JEEYOUNG;KIM, MIYONG;BRADEN, CARRIE JO",NA,"10.3928/24748307-20211104-01 [DOI]",NA,"2021/12/14 17:13 [ENTREZ];2021/12/15 06:00 [PUBMED];2021/12/15 06:00 [MEDLINE]","JOURNAL ARTICLE","BACKGROUND: HEALTH LITERACY AND ACCESS TO CARE ARE CRITICAL FACILITATORS FOR PREVENTIVE HEALTH BEHAVIORS. AFTER THE PASSAGE OF THE AFFORDABLE CARE ACT IN MARCH 2010, LITTLE HAS BEEN STUDIED ABOUT HOW IMPROVED HEALTH INSURANCE COVERAGE HAS IMPACTED THE USE OF PREVENTIVE HEALTH SERVICES AMONG KOREAN AMERICANS. OBJECTIVE: THE STUDY ASSESSED THE IMPACT OF ACCESS TO CARE, USE OF SERVICES, AND HEALTH LITERACY ON CANCER SCREENING AMONG KOREAN AMERICANS. METHODS: A DESCRIPTIVE CROSS-SECTIONAL STUDY OF 377 KOREAN AMERICANS AGE 18 YEARS AND OLDER WAS CONDUCTED WITH A SURVEY AND CONVENIENT SAMPLING IN TEXAS. KEY RESULTS: ALTHOUGH 79% OF THE SAMPLE HAD HEALTH INSURANCE, 32% HAD NEVER VISITED A HEALTH CARE PROVIDER, AND 14% WERE DELAYED IN CARE IN THE PAST 12 MONTHS. ONLY 11.6% WERE CONFIDENT TO COMPLETE MEDICAL FORMS, AND 69.5% HAD LIMITED LEVELS OF CONFIDENCE. CANCER SCREENING COMPLIANCE RATES WERE: MAMMOGRAPHY (50.4% AT AGE 40-54 YEARS; 46.6% AT AGE 55 YEARS AND OLDER), A PAP SMEAR (29.4% AT AGE 21-29 YEARS; 78.4% AT AGE 30-65 YEARS; 72.2% AT AGE 66 YEARS AND OLDER), AND COLORECTAL CANCER SCREENING AT AGE 45 YEARS AND OLDER (STOOL TESTS 15.1%; SIGMOIDOSCOPY 27%; COLONOSCOPY 51.3%). MULTIPLE LOGISTIC REGRESSION ANALYSES REVEALED THAT HOUSEHOLD INCOME, GENDER, HEALTH INSURANCE, AND HEALTH LITERACY WERE SIGNIFICANTLY ASSOCIATED WITH SELF-REPORTED CANCER SCREENING. CONCLUSIONS: KOREAN AMERICANS WHO PARTICIPATED IN THIS STUDY ARE CHARACTERIZED BY MARGINALIZED HEALTH LITERACY, UNDERUSED HEALTH CARE SERVICES, AND SIGNIFICANTLY LOWER CANCER SCREENING COMPLIANCE THAN THE GOALS OF HEALTHY PEOPLE 2020. THE FOLLOWING INTERVENTIONS ARE SUGGESTED TO IMPROVE HEALTH LITERACY AND HEALTH INSURANCE LITERACY ON CANCER SCREENING: CULTURALLY SENSITIVE AND LINGUISTICALLY APPROPRIATE EDUCATION FOR THE GUIDELINES CONCORDANT WITH CANCER SCREENING, EFFECTIVE COMMUNICATION SKILLS WITH HEALTH CARE PROVIDERS, SUPPORT FOR NAVIGATING THE HEALTH CARE SYSTEM, AND DEVELOPMENT OF INTERNET- OR SOCIAL MEDIA-BASED HEALTH EDUCATION PROGRAMS TO MEET THE PREFERRED COMMUNICATION METHODS OF THIS POPULATION. [HLRP: HEALTH LITERACY RESEARCH AND PRACTICE. 2021;5(4):E310-E318.] PLAIN LANGUAGE SUMMARY: DESPITE HAVING IMPROVED HEALTH INSURANCE COVERAGE, KOREAN AMERICANS OF THIS STUDY HAVE MARGINALIZED HEALTH LITERACY, LIMITED HEALTH INSURANCE LITERACY, LOW CANCER SCREENING COMPLIANCE, AND UNDERUSED HEALTH CARE SERVICES. THE RESULTS OF THIS STUDY SUGGEST SEVERAL STRATEGIES TO IMPROVE HEALTH LITERACY AND HEALTH INSURANCE LITERACY FOR KOREAN AMERICANS, WHICH MAY ALSO APPLY TO OTHER GROUPS WITH SIMILAR BARRIERS.",NA,NA,NA,NA,NA,"2021/12/14 17:13",NA,"20211209",2021,"2021/12/15 06:00",NA,NA,"4","2474-8307 (ELECTRONIC) 2475-6024 (PRINT) 2474-8307 (LINKING)","101712185","HEALTH LITERACY RESEARCH AND PRACTICE","ENG","10.3928/24748307-20211104-01 [DOI]","20211224","2021/12/15 06:00",NA,NA,NA,NA,"NLM","E310-E318",NA,"PMC8668165",NA,"34905432","PPUBLISH",NA,"IM",NA,"HEALTH LIT RES PRACT. 2021 OCT;5(4):E310-E318. DOI: 10.3928/24748307-20211104-01. EPUB 2021 DEC 9.","IN-DATA-REVIEW","HEALTH LIT RES PRACT","HEALTH LITERACY AND ACCESS TO CARE IN CANCER SCREENING AMONG KOREAN AMERICANS.",NA,"5","10.3928/24748307-20211104-01","PUBMED",NA,NA,0,"none",NA,"NOTREPORTED",NA,"LEE M, 2021, HEALTH LIT RES PRACT","LEE M, 2021, HEALTH LIT RES PRACT"
"CHRISTY SM;COUSIN LA;SUTTON SK;CHAVARRIA EA;ABDULLA R;GUTIERREZ L;SANCHEZ J;LOPEZ D;GWEDE CK;MEADE CD","CHRISTY, SHANNON M;COUSIN, LAKESHIA A;SUTTON, STEVEN K;CHAVARRIA, ENMANUEL A;ABDULLA, RANIA;GUTIERREZ, LILIANA;SANCHEZ, JULIAN;LOPEZ, DIANA;GWEDE, CLEMENT K;MEADE, CATHY D","AGED;COMMUNICATION BARRIERS;EARLY DETECTION OF CANCER/METHODS/STANDARDS/STATISTICS & NUMERICAL DATA;FEMALE;FLORIDA;HEALTH LITERACY/CLASSIFICATION/STANDARDS/STATISTICS & NUMERICAL DATA;HISPANIC OR LATINO/PSYCHOLOGY/STATISTICS & NUMERICAL DATA;HUMANS;MALE;MIDDLE AGED;PILOT PROJECTS;SURVEYS AND QUESTIONNAIRES","00006199-900000000-99667 [PII];10.1097/NNR.0000000000000519 [DOI]",NA,"2021/05/15 06:00 [PUBMED];2021/09/21 06:00 [MEDLINE];2021/05/14 20:27 [ENTREZ]","JOURNAL ARTICLE;RANDOMIZED CONTROLLED TRIAL;RESEARCH SUPPORT, N.I.H., EXTRAMURAL;RESEARCH SUPPORT, NON-U.S. GOV'T","BACKGROUND: CULTURAL BACKGROUND, LANGUAGE, AND LITERACY ARE FACTORS THAT MAY AFFECT ACCESS, HEALTHCARE UTILIZATION, AND CANCER SCREENING BEHAVIORS. OBJECTIVE: THIS STUDY AIMED TO CHARACTERIZE HEALTH LITERACY AMONG SPANISH-PREFERRING HISPANIC/LATINO INDIVIDUALS AGES 50-75 AND EXAMINE ASSOCIATIONS BETWEEN SOCIODEMOGRAPHIC CHARACTERISTICS, HEALTH BELIEFS, AND HEALTH LITERACY. METHODS: PARTICIPANTS SELF-IDENTIFIED AS HISPANIC/LATINO, PREFERRING HEALTH INFORMATION IN SPANISH, WERE AGES 50-75 YEARS OLD, AT AVERAGE RISK FOR COLORECTAL CANCER (CRC), NOT UP TO DATE WITH CRC SCREENING, AND ENROLLED IN A CRC SCREENING EDUCATION INTERVENTION TRIAL. SOCIODEMOGRAPHIC CHARACTERISTICS, HEALTH BELIEFS, AND HEALTH LITERACY (I.E., DIFFICULTY UNDERSTANDING WRITTEN HEALTH INFORMATION AND CONFIDENCE COMPLETING HEALTH FORMS) WERE ASSESSED AT BASELINE. DESCRIPTIVE AND LOGISTIC REGRESSION ANALYSES WERE PERFORMED. RESULTS: FIFTY-THREE PERCENT OF PARTICIPANTS REPORTED EITHER SOMETIMES HAVING DIFFICULTY OR ALWAYS HAVING DIFFICULTY WITH WRITTEN HEALTH INFORMATION, AND 25% REPORTED ALWAYS ASKING FOR HELP OR BEING NOT SO CONFIDENT IN COMPLETING HEALTH FORMS. UNIVARIATE PREDICTORS OF ADEQUATE HEALTH LITERACY FOR WRITTEN HEALTH INFORMATION WERE LOWER CANCER WORRY AND LOWER RELIGIOUS BELIEFS. HIGHER EDUCATIONAL ATTAINMENT PREDICTED CONFIDENCE IN COMPLETING HEALTH FORMS. CONCLUSIONS: FINDINGS HIGHLIGHT THE NEED FOR INTERVENTIONS THAT ADDRESS HEALTH BELIEFS AND HEALTH LITERACY AMONG HISPANIC/LATINO PATIENTS WHO HAVE LOW CONFIDENCE IN COMPLETING WRITTEN FORMS AND DIFFICULTY UNDERSTANDING WRITTEN INFORMATION AND REINFORCE THE USE OF PLAIN LANGUAGE AND SALIENT DESIGN FEATURES WHEN DEVELOPING PATIENT EDUCATION MATERIALS.",NA,"ORCID: 0000-0001-5306-7020 ORCID: 0000-0002-9649-8864 ORCID: 0000-0002-2504-7601 ORCID: 0000-0001-8418-5361 ORCID: 0000-0003-1630-7333","COPYRIGHT 2021 WOLTERS KLUWER HEALTH, INC. ALL RIGHTS RESERVED.","THE AUTHORS HAVE NO CONFLICTS OF INTEREST TO REPORT.",NA,"2021/05/14 20:27","20210920",NA,2021,"2021/05/15 06:00",NA,"P30 CA076292/CA/NCI NIH HHS/UNITED STATES R25 CA090314/CA/NCI NIH HHS/UNITED STATES T32 CA090314/CA/NCI NIH HHS/UNITED STATES","5","1538-9847 (ELECTRONIC) 0029-6562 (PRINT) 0029-6562 (LINKING)","0376404","NURSING RESEARCH","ENG","10.1097/NNR.0000000000000519 [DOI]","20220102","2021/09/21 06:00","NIHMS1698664",NA,NA,NA,"NLM","344-353",NA,"PMC8405461",NA,"33990120","PPUBLISH",NA,"IM","CLINICALTRIALS.GOV/NCT03078361","NURS RES. 2021 SET/OCT 01;70(5):344-353. DOI: 10.1097/NNR.0000000000000519.","MEDLINE","NURS RES","CHARACTERIZING HEALTH LITERACY AMONG SPANISH LANGUAGE-PREFERRING LATINOS AGES 50-75.",NA,"70","10.1097/NNR.0000000000000519","PUBMED","AGED;COMMUNICATION BARRIERS;EARLY DETECTION OF CANCER/METHODS/STANDARDS/STATISTICS & NUMERICAL DATA;FEMALE;FLORIDA;HEALTH LITERACY/CLASSIFICATION/STANDARDS/STATISTICS & NUMERICAL DATA;HISPANIC OR LATINO/PSYCHOLOGY/STATISTICS & NUMERICAL DATA;HUMANS;MALE;MIDDLE AGED;PILOT PROJECTS;SURVEYS AND QUESTIONNAIRES",NA,0,"none",NA,"NOTREPORTED",NA,"CHRISTY SM, 2021, NURS RES","CHRISTY SM, 2021, NURS RES"
