"AU","AF","DE","AID","OT","PHST","DT","AB","C1","OI","CI","COIS","CON","CRDT","DCOM","DEP","PY","EDAT","EIN","GR","IS","SN","JID","SO","LA","LID","LR","MHDA","MID","OAB","OABL","OTO","OWN","PP","PL","PMC","PMCR","PMID","PST","RN","SB","SI","SO2","STAT","J9","TI","TT","VL","DI","DB","ID","RP","TC","CR","AU_UN","AU1_UN","AU_UN_NR","SR_FULL","SR"
"NUTBEAM D;LLOYD JE","NUTBEAM, DON;LLOYD, JANE E","HEALTH LITERACY/ORGANIZATION & ADMINISTRATION/STATISTICS & NUMERICAL DATA;HUMANS;SOCIAL DETERMINANTS OF HEALTH","10.1146/ANNUREV-PUBLHEALTH-090419-102529 [DOI]","*HEALTH COMMUNICATION;*HEALTH EDUCATION;*HEALTH EQUITY;*HEALTH LITERACY;*HEALTH PROMOTION;*SOCIAL DETERMINANTS OF HEALTH","2020/10/10 06:00 [PUBMED];2021/06/24 06:00 [MEDLINE];2020/10/09 20:08 [ENTREZ]","JOURNAL ARTICLE;REVIEW","EVIDENCE OF A SOCIAL GRADIENT IN HEALTH LITERACY HAS BEEN FOUND IN ALL REPORTED NATIONAL POPULATION SURVEYS. HEALTH LITERACY IS A MIDSTREAM DETERMINANT OF HEALTH BUT NOT A PANACEA FOR ADDRESSING HEALTH INEQUITIES CREATED BY THE MALDISTRIBUTION OF OPPORTUNITY AND RESOURCES. IT IS POSSIBLE TO OPTIMIZE THE CONTRIBUTION HEALTH LITERACY MAKES IN MEDIATING THE CAUSES AND EFFECTS OF ESTABLISHED SOCIAL DETERMINANTS OF HEALTH. EXISTING INTERVENTIONS DEMONSTRATE THE FEASIBILITY OF IMPROVING HEALTH LITERACY AMONG HIGHER-RISK POPULATIONS, BUT RESEARCH REMAINS UNDERDEVELOPED AND EFFECTS ON HEALTH INEQUITY ARE LARGELY UNTESTED. FUTURE HEALTH LITERACY INTERVENTION RESEARCH SHOULD FOCUS ON (A) IMPROVING THE QUALITY OF HEALTH COMMUNICATION THAT REACHES A DIVERSITY OF POPULATIONS, ESPECIALLY BY IMPROVING FRONTLINE PROFESSIONAL SKILLS AND SUPPORT; (B) ENABLING PEOPLE TO DEVELOP TRANSFERABLE SKILLS IN ACCESSING, UNDERSTANDING, ANALYZING, AND APPLYING HEALTH INFORMATION; AND (C) ENSURING THAT PRIORITY IS PROPORTIONATE TO NEED BY REACHING AND ENGAGING THE POPULATION GROUPS WHO ARE DISPROPORTIONATELY AFFECTED BY LOW HEALTH LITERACY.","SYDNEY SCHOOL OF PUBLIC HEALTH, UNIVERSITY OF SYDNEY, SYDNEY, NEW SOUTH WALES 2006, AUSTRALIA; EMAIL: DON.;NUTBEAM@SYDNEY.;EDU.;AU.; CENTRE FOR PRIMARY HEALTH CARE AND EQUITY, UNIVERSITY OF NEW SOUTH WALES, SYDNEY, NEW SOUTH WALES 2052, AUSTRALIA; EMAIL: J.;LLOYD@UNSW.;EDU.;AU.;",NA,NA,NA,NA,"2020/10/09 20:08","20210623","20211009",2021,"2020/10/10 06:00",NA,NA,NA,"1545-2093 (ELECTRONIC) 0163-7525 (LINKING)","8006431","ANNUAL REVIEW OF PUBLIC HEALTH","ENG","10.1146/ANNUREV-PUBLHEALTH-090419-102529 [DOI]","20210623","2021/06/24 06:00",NA,NA,NA,"NOTNLM","NLM","159-173","UNITED STATES",NA,NA,"33035427","PPUBLISH",NA,"IM",NA,"ANNU REV PUBLIC HEALTH. 2021 APR 1;42:159-173. DOI: 10.1146/ANNUREV-PUBLHEALTH-090419-102529. EPUB 2021 OCT 9.","MEDLINE","ANNU REV PUBLIC HEALTH","UNDERSTANDING AND RESPONDING TO HEALTH LITERACY AS A SOCIAL DETERMINANT OF HEALTH.",NA,"42","10.1146/ANNUREV-PUBLHEALTH-090419-102529","PUBMED","HEALTH LITERACY/ORGANIZATION & ADMINISTRATION/STATISTICS & NUMERICAL DATA;HUMANS;SOCIAL DETERMINANTS OF HEALTH",NA,0,"none","UNIVERSITY OF SYDNEY;UNIVERSITY OF NEW SOUTH WALES","UNIVERSITY OF SYDNEY;NOTREPORTED;NOTREPORTED;NOTREPORTED;NOTREPORTED;UNIVERSITY OF NEW SOUTH WALES;NOTREPORTED;NOTREPORTED;NOTREPORTED;NOTREPORTED",NA,"NUTBEAM D, 2021, ANNU REV PUBLIC HEALTH","NUTBEAM D, 2021, ANNU REV PUBLIC HEALTH"
"HOUSTEN AJ;GUNN CM;PAASCHE-ORLOW MK;BASEN-ENGQUIST KM","HOUSTEN, A J;GUNN, C M;PAASCHE-ORLOW, M K;BASEN-ENGQUIST, K M","HEALTH LITERACY;HUMANS;NEOPLASMS/DIAGNOSIS/PREVENTION & CONTROL;UNITED STATES","10.1007/S13187-020-01915-X [PII];10.1007/S13187-020-01915-X [DOI]","*CANCER;*HEALTH LITERACY;*NEOPLASMS;*ONCOLOGY","2020/10/27 00:00 [ACCEPTED];2022/04/01 00:00 [PMC-RELEASE];2020/11/07 06:00 [PUBMED];2021/09/01 06:00 [MEDLINE];2020/11/06 06:01 [ENTREZ]","JOURNAL ARTICLE;RESEARCH SUPPORT, N.I.H., EXTRAMURAL;RESEARCH SUPPORT, NON-U.S. GOV'T;RESEARCH SUPPORT, U.S. GOV'T, P.H.S.;REVIEW;SYSTEMATIC REVIEW","APPROXIMATELY ONE-THIRD OF ADULTS IN THE UNITED STATES (U.S.) HAVE LIMITED HEALTH LITERACY. THOSE WITH LIMITED HEALTH LITERACY OFTEN HAVE DIFFICULTLY NAVIGATING THE HEALTH CARE ENVIRONMENT, INCLUDING NAVIGATING CARE ACROSS THE CANCER CONTINUUM (E.G., PREVENTION, SCREENING, DIAGNOSIS, TREATMENT). EVIDENCE-BASED INTERVENTIONS TO ASSIST ADULTS WITH LIMITED HEALTH LITERACY IMPROVE HEALTH OUTCOMES; HOWEVER, LITTLE IS KNOWN ABOUT HEALTH LITERACY INTERVENTIONS IN THE CONTEXT OF CANCER AND THEIR IMPACT ON CANCER-SPECIFIC HEALTH OUTCOMES. THE PURPOSE OF THIS REVIEW WAS TO IDENTIFY AND CHARACTERIZE THE LITERATURE ON HEALTH LITERACY INTERVENTIONS ACROSS THE CANCER CARE CONTINUUM. SPECIFICALLY, OUR AIM WAS TO REVIEW THE STRENGTH OF EVIDENCE, OUTCOMES ASSESSED, AND INTERVENTION MODALITIES WITHIN THE EXISTING LITERATURE REPORTING HEALTH LITERACY INTERVENTIONS IN CANCER. OUR SEARCH YIELDED 1036 RECORDS (PREVENTION/SCREENING N = 174; DIAGNOSIS/TREATMENT N = 862). FOLLOWING DEDUPLICATION AND REVIEW FOR INCLUSION CRITERIA, WE ANALYZED 87 RECORDS OF INTERVENTION STUDIES REPORTING HEALTH LITERACY OUTCOMES, INCLUDING 45 PILOT STUDIES (PREVENTION/SCREENING N = 24; DIAGNOSIS/TREATMENT N = 21) AND 42 RANDOMIZED CONTROLLED TRIALS OR QUASI-EXPERIMENTAL TRIALS (PREVENTION/SCREENING N = 31; DIAGNOSIS/TREATMENT N = 11). THIS LITERATURE INCLUDED 36 UNIQUE INTERVENTIONS (PREVENTION/SCREENING N = 28; DIAGNOSIS/TREATMENT N = 8), MOSTLY IN THE FORMATIVE STAGES OF INTERVENTION DEVELOPMENT, WITH FEW ASSESSMENTS OF EVIDENCE-BASED INTERVENTIONS. THESE GAPS IN THE LITERATURE NECESSITATE FURTHER RESEARCH IN THE DEVELOPMENT AND IMPLEMENTATION OF EVIDENCE-BASED HEALTH LITERACY INTERVENTIONS TO IMPROVE CANCER OUTCOMES.","DEPARTMENT OF SURGERY, DIVISION OF PUBLIC HEALTH SCIENCES, WASHINGTON UNIVERSITY SCHOOL OF MEDICINE, 660 S.; EUCLID AVE.; CAMPUS BOX 8100, ST.; LOUIS, MO, 63110, USA.; AHOUSTEN@WUSTL.;EDU.; SECTION OF GENERAL INTERNAL MEDICINE, BOSTON UNIVERSITY SCHOOL OF MEDICINE, BOSTON, MA, USA.; SECTION OF GENERAL INTERNAL MEDICINE, BOSTON UNIVERSITY SCHOOL OF MEDICINE, BOSTON, MA, USA.; DEPARTMENT OF BEHAVIORAL SCIENCE, DIVISION OF CANCER PREVENTION AND POPULATION SCIENCES, THE UNIVERSITY OF TEXAS MD ANDERSON CANCER CENTER, HOUSTON, TX, USA.;","ORCID: 0000-0002-7379-0678",NA,"CONFLICTS OF INTEREST/COMPETING INTERESTS: AUTHORS HAVE NO CONFLICTS OF INTEREST TO REPORT AT THIS TIME.",NA,"2020/11/06 06:01","20210831","20201105",2021,"2020/11/07 06:00",NA,"R00 MD011485/MD/NIMHD NIH HHS/UNITED STATES R00MD011485/MD/NIMHD NIH HHS/UNITED STATES 1UL1TR001430/NH/NIH HHS/UNITED STATES 1K07CA221899/CA/NCI NIH HHS/UNITED STATES K07 CA221899/CA/NCI NIH HHS/UNITED STATES UL1 TR001430/TR/NCATS NIH HHS/UNITED STATES","2","1543-0154 (ELECTRONIC) 0885-8195 (PRINT) 0885-8195 (LINKING)","8610343","JOURNAL OF CANCER EDUCATION : THE OFFICIAL JOURNAL OF THE AMERICAN ASSOCIATION FOR CANCER EDUCATION","ENG","10.1007/S13187-020-01915-X [DOI]","20210831","2021/09/01 06:00","NIHMS1644529",NA,NA,"NOTNLM","NLM","240-252",NA,"PMC8005416","2022/04/01","33155097","PPUBLISH",NA,"IM",NA,"J CANCER EDUC. 2021 APR;36(2):240-252. DOI: 10.1007/S13187-020-01915-X. EPUB 2020 NOV 5.","MEDLINE","J CANCER EDUC","HEALTH LITERACY INTERVENTIONS IN CANCER: A SYSTEMATIC REVIEW.",NA,"36","10.1007/S13187-020-01915-X","PUBMED","HEALTH LITERACY;HUMANS;NEOPLASMS/DIAGNOSIS/PREVENTION & CONTROL;UNITED STATES",NA,0,"none","WASHINGTON UNIVERSITY SCHOOL OF MEDICINE;BOSTON UNIVERSITY SCHOOL OF MEDICINE;BOSTON UNIVERSITY SCHOOL OF MEDICINE;THE UNIVERSITY OF TEXAS MD ANDERSON CANCER CENTER","WASHINGTON UNIVERSITY SCHOOL OF MEDICINE;NOTREPORTED;NOTREPORTED;NOTREPORTED;NOTREPORTED;NOTREPORTED;BOSTON UNIVERSITY SCHOOL OF MEDICINE;BOSTON UNIVERSITY SCHOOL OF MEDICINE;THE UNIVERSITY OF TEXAS MD ANDERSON CANCER CENTER",NA,"HOUSTEN AJ, 2021, J CANCER EDUC","HOUSTEN AJ, 2021, J CANCER EDUC"
"MOORE C;HASSETT D;DUNNE S","MOORE, CHLOE;HASSETT, DANIELLE;DUNNE, SIMON",NA,"10.1007/S11764-020-00975-8 [PII];10.1007/S11764-020-00975-8 [DOI]","CANCER;CANCER CAREGIVER;HEALTH LITERACY;ONCOLOGY;SYSTEMATIC REVIEW","2020/08/28 00:00 [RECEIVED];2020/11/25 00:00 [ACCEPTED];2021/01/08 06:00 [PUBMED];2021/01/08 06:00 [MEDLINE];2021/01/07 06:12 [ENTREZ]","JOURNAL ARTICLE;REVIEW","PURPOSE: CANCER CAREGIVERS PLAY A VITAL ROLE IN THE CARE AND HEALTH DECISION-MAKING OF CANCER SURVIVORS. CONSEQUENTLY, THEIR HEALTH LITERACY LEVELS MAY BE PARTICULARLY IMPORTANT, AS LOW LEVELS MAY IMPEDE ADEQUATE CARE PROVISION. AS SUCH, THE CURRENT REVIEW AIMED TO SYSTEMATICALLY EXAMINE THE LITERATURE ON HEALTH LITERACY AMONGST CANCER CAREGIVERS. METHODS: WE SYSTEMATICALLY SEARCHED THE FOLLOWING DATABASES USING CONTROLLED VOCABULARY AND FREE-TEXT TERMS: PSYCHINFO, MEDLINE, EMBASE, CINAHL AND WEB OF SCIENCE. PEER-REVIEWED EMPIRICAL STUDIES THAT EXPLICITLY MEASURED AND REPORTED CANCER CAREGIVER HEALTH LITERACY LEVELS WERE INCLUDED. RESULTS: THE SEARCH YIELDED SIX ARTICLES CONSISTING OF 593 CANCER CAREGIVERS EXPLORING HEALTH LITERACY AND EHEALTH LITERACY. THERE WAS SUBSTANTIAL VARIATION IN HEALTH LITERACY MEASUREMENT TOOLS USED ACROSS INCLUDED STUDIES, PRECLUDING THE POSSIBILITY OF CONDUCTING A META-ANALYSIS. THE INCLUDED ARTICLES REPORTED SIGNIFICANT ASSOCIATIONS (LIMITED TO SINGLE STUDIES) BETWEEN CAREGIVER HEALTH/EHEALTH LITERACY AND (I) CANCER SURVIVOR DEMOGRAPHICS, (II) CAREGIVERS' COMMUNICATION STYLE, (III) CAREGIVER INTERNET ACCESS AND (IV) CAREGIVER COPING STRATEGIES. CONCLUSIONS: FINDINGS HIGHLIGHT A NEED FOR FUTURE LONGITUDINAL RESEARCH REGARDING CANCER CAREGIVER HEALTH LITERACY INCORPORATING MORE STANDARDIZED AND POPULATION-SPECIFIC MEASUREMENT APPROACHES. IN PARTICULAR, THERE IS A PRESSING NEED TO INVESTIGATE FACTORS ASSOCIATED WITH CANCER CAREGIVER HEALTH LITERACY TO INFORM THE DEVELOPMENT/DELIVERY OF FUTURE INTERVENTIONS. IMPLICATIONS FOR CANCER SURVIVORS: FUTURE HIGH-QUALITY RESEARCH WHICH INVESTIGATES THE FACTORS WHICH CONTRIBUTE TOWARDS SUB-OPTIMAL HEALTH LITERACY AMONGST CANCER CAREGIVERS WOULD AID IN THE DEVELOPMENT OF APPROPRIATE AND EFFECTIVE HEALTH LITERACY INTERVENTIONS IN THESE GROUPS. SUCH INTERVENTIONS WOULD ALLOW THIS IMPORTANT GROUP TO PROVIDE APPROPRIATE SUPPORT TO CANCER SURVIVORS AND ENHANCE SURVIVORS' ENGAGEMENT IN THEIR HEALTH AND WELLBEING.","SCHOOL OF PSYCHOLOGY, DUBLIN CITY UNIVERSITY, DUBLIN, IRELAND.; SCHOOL OF PSYCHOLOGY, DUBLIN CITY UNIVERSITY, DUBLIN, IRELAND.; SCHOOL OF PSYCHOLOGY, DUBLIN CITY UNIVERSITY, DUBLIN, IRELAND.; SIMON.;DUNNE@DCU.;IE.;","ORCID: 0000-0003-3655-7647"," 2021. THE AUTHOR(S), UNDER EXCLUSIVE LICENCE TO SPRINGER SCIENCE+BUSINESS MEDIA, LLC PART OF SPRINGER NATURE.",NA,NA,"2021/01/07 06:12",NA,"20210107",2021,"2021/01/08 06:00",NA,NA,"6","1932-2267 (ELECTRONIC) 1932-2259 (LINKING)","101307557","JOURNAL OF CANCER SURVIVORSHIP : RESEARCH AND PRACTICE","ENG","10.1007/S11764-020-00975-8 [DOI]","20211018","2021/01/08 06:00",NA,NA,NA,"NOTNLM","NLM","825-836","UNITED STATES",NA,NA,"33409857","PPUBLISH",NA,"IM",NA,"J CANCER SURVIV. 2021 DEC;15(6):825-836. DOI: 10.1007/S11764-020-00975-8. EPUB 2021 JAN 7.","IN-DATA-REVIEW","J CANCER SURVIV","HEALTH LITERACY IN CANCER CAREGIVERS: A SYSTEMATIC REVIEW.",NA,"15","10.1007/S11764-020-00975-8","PUBMED",NA,NA,0,"none","DUBLIN CITY UNIVERSITY;DUBLIN CITY UNIVERSITY;DUBLIN CITY UNIVERSITY","DUBLIN CITY UNIVERSITY;DUBLIN CITY UNIVERSITY;DUBLIN CITY UNIVERSITY;NOTREPORTED;NOTREPORTED;NOTREPORTED",NA,"MOORE C, 2021, J CANCER SURVIV","MOORE C, 2021, J CANCER SURVIV"
"ERONEN J;PAAKKARI L;PORTEGIJS E;SAAJANAHO M;RANTANEN T","ERONEN, JOHANNA;PAAKKARI, LEENA;PORTEGIJS, ERJA;SAAJANAHO, MILLA;RANTANEN, TAINA","AGED;AGED, 80 AND OVER;AGING;CROSS-SECTIONAL STUDIES;FEMALE;FINLAND;HEALTH LITERACY;HUMANS;MALE;MIDDLE AGED;SURVEYS AND QUESTIONNAIRES","S0091-7435(20)30361-3 [PII];10.1016/J.YPMED.2020.106330 [DOI]","*AGING;*COHORT STUDY;*HEALTH LITERACY;*HEALTH PROMOTION;*MULTIMORBIDITY","2020/04/09 00:00 [RECEIVED];2020/09/14 00:00 [REVISED];2020/11/15 00:00 [ACCEPTED];2020/11/22 06:00 [PUBMED];2021/06/25 06:00 [MEDLINE];2020/11/21 20:07 [ENTREZ]","JOURNAL ARTICLE;RESEARCH SUPPORT, NON-U.S. GOV'T","FROM THE INDIVIDUAL VIEWPOINT, ACTIVE AGING REFERS TO THE ABILITY OF OLDER PERSONS, DEPENDING ON THEIR GOALS, FUNCTIONAL CAPACITY AND OPPORTUNITIES, TO ENGAGE IN DESIRED ACTIVITIES. THIS STUDY INVESTIGATED THE ROLE OF HEALTH LITERACY IN ACTIVE AGING AMONG PERSONS DIFFERING IN THEIR NUMBER OF CHRONIC CONDITIONS. DATA WERE COLLECTED FROM 948 INDIVIDUALS, 57% WOMEN, AGED 75, 80 AND 85 IN 2017-2018 IN THE CITY OF JYVSKYL IN CENTRAL FINLAND. HEALTH LITERACY WAS ASSESSED WITH THE 16-QUESTION VERSION OF THE EUROPEAN HEALTH LITERACY SURVEY (HLS-EU-Q16), ACTIVE AGING WITH THE UNIVERSITY OF JYVSKYL ACTIVE AGING SCALE (UJACAS) AND SELF-REPORTED PHYSICIAN-DIAGNOSED CHRONIC CONDITIONS. BOTH HEALTH LITERACY (R=0.40) AND NUMBER OF CHRONIC CONDITIONS (R=-0.21) CORRELATED WITH THE ACTIVE AGING SCORE. LINEAR REGRESSION MODELS REVEALED THAT HEALTH LITERACY WAS A STRONGER PREDICTOR THAN CHRONIC CONDITIONS OF ACTIVE AGING ( 0.18, P<0.001 VS. -0.06, P=0.030) AND THAT ITS PREDICTIVE VALUE REMAINED STATISTICALLY SIGNIFICANT AFTER ADJUSTMENT FOR COGNITIVE CAPACITY, NUMBER OF DEPRESSIVE SYMPTOMS, PHYSICAL PERFORMANCE AND LENGTH OF EDUCATION. HIGHER HEALTH LITERACY CAN ENABLE OLDER PERSONS, INCLUDING THOSE WITH MULTIPLE CHRONIC CONDITIONS, TO MAINTAIN HIGHER LEVELS OF ACTIVE AGING. AS MORE PEOPLE ARE PROJECTED TO LIVE WITH CHRONIC CONDITIONS TO OLDER AGES, HEALTH LITERACY MAY HELP THEM TO COPE WITH ILLNESSES AND FUNCTIONAL LIMITATIONS AND LEAD A FULFILLING LIFE. THESE CROSS-SECTIONAL FINDINGS LAY A FOUNDATION FOR FUTURE PROSPECTIVE AND EXPERIMENTAL STUDIES ON HEALTH LITERACY AND ACTIVE AGING.","GERONTOLOGY RESEARCH CENTER, FACULTY OF SPORT AND HEALTH SCIENCES, UNIVERSITY OF JYVSKYL, FINLAND.; ELECTRONIC ADDRESS: JOHANNA.;ERONEN@JYU.;FI.; RESEARCH CENTER FOR HEALTH PROMOTION, FACULTY OF SPORT AND HEALTH SCIENCES, UNIVERSITY OF JYVSKYL, FINLAND.; GERONTOLOGY RESEARCH CENTER, FACULTY OF SPORT AND HEALTH SCIENCES, UNIVERSITY OF JYVSKYL, FINLAND.; GERONTOLOGY RESEARCH CENTER, FACULTY OF SPORT AND HEALTH SCIENCES, UNIVERSITY OF JYVSKYL, FINLAND.; GERONTOLOGY RESEARCH CENTER, FACULTY OF SPORT AND HEALTH SCIENCES, UNIVERSITY OF JYVSKYL, FINLAND.;",NA,"COPYRIGHT 2020 ELSEVIER INC. ALL RIGHTS RESERVED.",NA,NA,"2020/11/21 20:07","20210624","20201119",2021,"2020/11/22 06:00",NA,NA,NA,"1096-0260 (ELECTRONIC) 0091-7435 (LINKING)","0322116","PREVENTIVE MEDICINE","ENG","S0091-7435(20)30361-3 [PII] 10.1016/J.YPMED.2020.106330 [DOI]","20210624","2021/06/25 06:00",NA,NA,NA,"NOTNLM","NLM","106330","UNITED STATES",NA,NA,"33220399","PPUBLISH",NA,"IM",NA,"PREV MED. 2021 FEB;143:106330. DOI: 10.1016/J.YPMED.2020.106330. EPUB 2020 NOV 19.","MEDLINE","PREV MED","HEALTH LITERACY SUPPORTS ACTIVE AGING.",NA,"143","S0091-7435(20)30361-3","PUBMED","AGED;AGED, 80 AND OVER;AGING;CROSS-SECTIONAL STUDIES;FEMALE;FINLAND;HEALTH LITERACY;HUMANS;MALE;MIDDLE AGED;SURVEYS AND QUESTIONNAIRES",NA,0,"none","UNIVERSITY OF JYVSKYL;ELECTRONIC ADDRESS: JOHANNA.;UNIVERSITY OF JYVSKYL;UNIVERSITY OF JYVSKYL;UNIVERSITY OF JYVSKYL;UNIVERSITY OF JYVSKYL","UNIVERSITY OF JYVSKYL;ELECTRONIC ADDRESS: JOHANNA.;NOTREPORTED;NOTREPORTED;UNIVERSITY OF JYVSKYL;UNIVERSITY OF JYVSKYL;UNIVERSITY OF JYVSKYL;UNIVERSITY OF JYVSKYL",NA,"ERONEN J, 2021, PREV MED","ERONEN J, 2021, PREV MED"
"TRAN ED;VAISBUCH Y;QIAN ZJ;FITZGERALD MB;MEGWALU UC","TRAN, EMMA D;VAISBUCH, YONA;QIAN, Z JASON;FITZGERALD, MATTHEW B;MEGWALU, UCHECHUKWU C","ADULT;AGED;AGED, 80 AND OVER;AUDIOMETRY/STATISTICS & NUMERICAL DATA;CROSS-SECTIONAL STUDIES;EDUCATIONAL STATUS;FEMALE;HEALTH LITERACY/STATISTICS & NUMERICAL DATA;HEARING AIDS/ECONOMICS/STATISTICS & NUMERICAL DATA;HEARING LOSS/DIAGNOSIS/ECONOMICS/THERAPY;HUMANS;INSURANCE COVERAGE/ECONOMICS/STATISTICS & NUMERICAL DATA;INSURANCE, HEALTH/ECONOMICS/STATISTICS & NUMERICAL DATA;MALE;MIDDLE AGED;PATIENT ACCEPTANCE OF HEALTH CARE/STATISTICS & NUMERICAL DATA;SELF REPORT/STATISTICS & NUMERICAL DATA;SEVERITY OF ILLNESS INDEX;YOUNG ADULT","10.1002/LARY.29313 [DOI]","*HEALTH LITERACY;*HEALTHCARE ACCESS;*HEARING AID;*HEARING HEALTHCARE;*HEARING LOSS","2020/10/24 00:00 [REVISED];2020/06/29 00:00 [RECEIVED];2020/11/23 00:00 [ACCEPTED];2020/12/12 06:00 [PUBMED];2021/05/08 06:00 [MEDLINE];2020/12/11 08:39 [ENTREZ]","JOURNAL ARTICLE","OBJECTIVE: TO ASSESS WHETHER HEALTH LITERACY IS ASSOCIATED WITH: 1) DEGREE OF HEARING LOSS AT INITIAL PRESENTATION FOR AUDIOGRAM AND 2) HEARING AID ADOPTION FOR HEARING AID CANDIDATES. METHODS: WE IDENTIFIED 1376 PATIENTS WHO UNDERWENT AUDIOMETRIC TESTING AND COMPLETED A BRIEF HEALTH LITERACY QUESTIONNAIRE AT OUR INSTITUTION. THE ASSOCIATION BETWEEN HEALTH LITERACY AND DEGREE OF HEARING LOSS AT INITIAL PRESENTATION WAS EXAMINED USING LINEAR REGRESSION, ADJUSTED FOR AGE, GENDER, MARITAL STATUS, EDUCATION LEVEL, RACE, LANGUAGE, EMPLOYMENT STATUS, AND INSURANCE COVERAGE. THE ASSOCIATION BETWEEN HEALTH LITERACY AND HEARING AID ADOPTION WAS EXAMINED IN THE SUBSET OF PATIENTS IDENTIFIED AS HEARING AID CANDIDATES USING LOGISTIC REGRESSION, ADJUSTED FOR DEMOGRAPHIC FACTORS AND INSURANCE COVERAGE. RESULTS: PATIENTS WITH INADEQUATE HEALTH LITERACY WERE MORE LIKELY TO PRESENT WITH MORE SEVERE HEARING LOSS (ADJUSTED MEAN PURE-TONE AVERAGE [PTA] DIFFERENCE, 5.38DB, 95% CONFIDENCE INTERVAL [CI] 2.75 TO 8.01). FOR HEARING AID CANDIDATES (N = 472 [41.6%]), HEALTH LITERACY WAS NOT ASSOCIATED WITH HEARING AID ADOPTION RATE (ODDS RATIO [OR] 0.85, 95% CI 0.40 TO 1.76). HEARING AID COVERAGE THROUGH MEDICAID (OR 2.22, 95% CI 1.13 TO 4.37), AND MODERATE (OR 2.70, 95% CI 1.58 TO 4.69) OR MODERATE-SEVERE (OR 2.23, 95% CI 1.19 TO 4.16) HEARING LOSS WERE ASSOCIATED WITH HEARING AID ADOPTION. CONCLUSIONS: IN OUR POPULATION, PATIENTS WITH LOW HEALTH LITERACY ARE MORE LIKELY TO PRESENT WITH HIGHER DEGREES OF HEARING LOSS, BUT NO LESS LIKELY TO OBTAIN HEARING AIDS COMPARED WITH PATIENTS WITH ADEQUATE HEALTH LITERACY. HEARING LOSS SEVERITY AND HEARING AID COVERAGE BY INSURANCE APPEAR TO BE THE MAIN DRIVERS OF HEARING AID ADOPTION. LEVEL OF EVIDENCE: 3 LARYNGOSCOPE, 131:E1688-E1694, 2021.","DEPARTMENT OF OTOLARYNGOLOGY-HEAD AND NECK SURGERY, STANFORD UNIVERSITY SCHOOL OF MEDICINE, STANFORD, CALIFORNIA, U.;S.;A.; DEPARTMENT OF OTOLARYNGOLOGY-HEAD AND NECK SURGERY, STANFORD UNIVERSITY SCHOOL OF MEDICINE, STANFORD, CALIFORNIA, U.;S.;A.; DEPARTMENT OF OTOLARYNGOLOGY-HEAD AND NECK SURGERY, STANFORD UNIVERSITY SCHOOL OF MEDICINE, STANFORD, CALIFORNIA, U.;S.;A.; DEPARTMENT OF OTOLARYNGOLOGY-HEAD AND NECK SURGERY, STANFORD UNIVERSITY SCHOOL OF MEDICINE, STANFORD, CALIFORNIA, U.;S.;A.; DEPARTMENT OF OTOLARYNGOLOGY-HEAD AND NECK SURGERY, STANFORD UNIVERSITY SCHOOL OF MEDICINE, STANFORD, CALIFORNIA, U.;S.;A.;","ORCID: 0000-0001-8056-6298 ORCID: 0000-0003-4150-1023 ORCID: 0000-0001-5132-8864"," 2020 AMERICAN LARYNGOLOGICAL, RHINOLOGICAL AND OTOLOGICAL SOCIETY INC, \"THE TRIOLOGICAL SOCIETY\" AND AMERICAN LARYNGOLOGICAL ASSOCIATION (ALA).",NA,NA,"2020/12/11 08:39","20210507","20201211",2021,"2020/12/12 06:00",NA,NA,"5","1531-4995 (ELECTRONIC) 0023-852X (LINKING)","8607378","THE LARYNGOSCOPE","ENG","10.1002/LARY.29313 [DOI]","20210507","2021/05/08 06:00",NA,NA,NA,"NOTNLM","NLM","E1688-E1694","UNITED STATES",NA,NA,"33305829","PPUBLISH",NA,"IM",NA,"LARYNGOSCOPE. 2021 MAY;131(5):E1688-E1694. DOI: 10.1002/LARY.29313. EPUB 2020 DEC 11.","MEDLINE","LARYNGOSCOPE","HEALTH LITERACY AND HEARING HEALTHCARE USE.",NA,"131","10.1002/LARY.29313","PUBMED","ADULT;AGED;AGED, 80 AND OVER;AUDIOMETRY/STATISTICS & NUMERICAL DATA;CROSS-SECTIONAL STUDIES;EDUCATIONAL STATUS;FEMALE;HEALTH LITERACY/STATISTICS & NUMERICAL DATA;HEARING AIDS/ECONOMICS/STATISTICS & NUMERICAL DATA;HEARING LOSS/DIAGNOSIS/ECONOMICS/THERAPY;HUMANS;INSURANCE COVERAGE/ECONOMICS/STATISTICS & NUMERICAL DATA;INSURANCE, HEALTH/ECONOMICS/STATISTICS & NUMERICAL DATA;MALE;MIDDLE AGED;PATIENT ACCEPTANCE OF HEALTH CARE/STATISTICS & NUMERICAL DATA;SELF REPORT/STATISTICS & NUMERICAL DATA;SEVERITY OF ILLNESS INDEX;YOUNG ADULT",NA,0,"none","STANFORD UNIVERSITY SCHOOL OF MEDICINE;STANFORD UNIVERSITY SCHOOL OF MEDICINE;STANFORD UNIVERSITY SCHOOL OF MEDICINE;STANFORD UNIVERSITY SCHOOL OF MEDICINE;STANFORD UNIVERSITY SCHOOL OF MEDICINE","STANFORD UNIVERSITY SCHOOL OF MEDICINE;NOTREPORTED;NOTREPORTED;STANFORD UNIVERSITY SCHOOL OF MEDICINE;NOTREPORTED;NOTREPORTED;STANFORD UNIVERSITY SCHOOL OF MEDICINE;NOTREPORTED;NOTREPORTED;STANFORD UNIVERSITY SCHOOL OF MEDICINE;NOTREPORTED;NOTREPORTED;STANFORD UNIVERSITY SCHOOL OF MEDICINE;NOTREPORTED;NOTREPORTED",NA,"TRAN ED, 2021, LARYNGOSCOPE","TRAN ED, 2021, LARYNGOSCOPE"
"SETTOON C;EVANS AK","SETTOON, CHRISTINE;EVANS, ADELE K","ADULT;CAREGIVERS;CHILD;HEALTH LITERACY;HEALTH STATUS;HUMANS;MIDDLE AGED;QUALITY OF LIFE;TRACHEOSTOMY;YOUNG ADULT","S0165-5876(20)30703-5 [PII];10.1016/J.IJPORL.2020.110560 [DOI]","HEALTH DISPARITIES;HEALTH LITERACY;PEDIATRIC TRACHEOSTOMY","2020/10/05 00:00 [RECEIVED];2020/12/10 00:00 [REVISED];2020/12/11 00:00 [ACCEPTED];2021/01/08 06:00 [PUBMED];2021/06/24 06:00 [MEDLINE];2021/01/07 20:12 [ENTREZ]","JOURNAL ARTICLE","INTRODUCTION: AS HEALTH OUTCOMES AND DISPARITIES BECOME MORE IMPORTANT IN NATIONAL HEALTHCARE, PHYSICIANS MUST BE AWARE OF EVERY PATIENT'S HEALTH LITERACY IN ORDER TO DELIVER EFFECTIVE CARE. OUR GOAL WAS TO MEASURE THE HEALTH LITERACY RATES IN THE CAREGIVERS OF OUR PEDIATRIC TRACHEOSTOMY POPULATION. THESE CAREGIVERS SPECIFICALLY HAVE AN IMMENSE RESPONSIBILITY THAT REQUIRES A CERTAIN CAPACITY FOR UNDERSTANDING AND LEARNING COMPLEX SKILLS. THUS FAR THERE HAVE BEEN NO STUDIES OR SURVEYS INVESTIGATING THE RATES OF HEALTH LITERACY IN THIS POPULATION OR TRACHEOSTOMY PATIENTS IN GENERAL. CAREGIVERS' LITERACY RATES WERE MEASURED BY ADMINISTERING A TEST OF FUNCTIONAL HEALTH LITERACY IN ADULTS (TOFHLA). THIS TEST USES ACTUAL MATERIALS THAT PATIENTS MIGHT ENCOUNTER IN A TYPICAL CLINIC AND CONSISTS OF A READING COMPREHENSION AND NUMERACY SECTION. TO ASSESS IMPACT OF THE COMPLEX CARE ON CAREGIVER QUALITY OF LIFE, WE SIMULTANEOUSLY ADMINISTERED THE PEDIATRIC TRACHEOSTOMY HEALTH STATUS INSTRUMENT (PTHSI), A VALIDATED CAREGIVER QUALITY OF LIFE MEASUREMENT. METHODS: CAREGIVERS OF CHILDREN WITH TRACHEOSTOMIES WERE RECRUITED AND SURVEYED DURING THE PEDIATRIC TRACHEOSTOMY CLINIC BETWEEN JULY 2019-OCTOBER 2019. TWENTY - SIX CAREGIVERS COMPLETED THE TOFHLA; 24 COMPLETED ALL THREE PARTS - THE TOFHLA, THE DEMOGRAPHIC SURVEY, AND THE PTHSI. RESULTS: HEALTH LITERACY RATES AMONG PATIENT FAMILIES IN THE OUT-PATIENT SETTING WITH EXPERIENCE WITH TRACHEOSTOMY WERE DEEMED \"ADEQUATE\" IN 85% OF CAREGIVERS; THE REMAINING 15% OF CAREGIVERS SCORED \"INADEQUATE\". OVERALL ADULT LITERACY RATES IN THE GENERAL POPULATION IN THIS STATE ARE 26% \"INADEQUATE.\" APPROXIMATELY 80% OF OUR CAREGIVERS RELY SOLELY ON MEDICAID FOR HEALTHCARE INSURANCE AND NEARLY HALF OF PARTICIPANTS REPORTED AN ANNUAL HOUSEHOLD INCOME LESS THAN $5000. AGES OF CAREGIVERS RANGED FROM 20 TO 61 YEARS, WITH NO SIGNIFICANT CORRELATION TO HEALTH LITERACY. THE AVERAGE PTHSI SCORE WAS 36 (SD 8.6), DENOTING A MODERATE LEVEL OF CAREGIVER BURDEN BUT NO CORRELATION TO THE CAREGIVER HEALTH LITERACY SCORE WAS FOUND. WHEN COMPARING CAREGIVER HEALTH LITERACY SCORES IN RELATION TO EDUCATION LEVEL, CAREGIVERS WITH COLLEGE AND POST-GRADUATE EDUCATION HAD HIGHER LITERACY SCORES THAN THOSE WITH A HIGH SCHOOL EDUCATION, P=.0086. IN ADDITION, WHEN COMPARING AFRICAN AMERICAN TO WHITE CAREGIVERS, WHITE CAREGIVERS WERE FOUND TO HAVE HIGHER HEALTH LITERACY SCORES, P=.036. NOTABLY, CAREGIVER BURDEN AS MEASURED BY THE PTHSI SCORE DID NOT DIFFER SIGNIFICANTLY BETWEEN CAREGIVERS IN LOWER INCOME AND HIGHER INCOME LEVELS, P=.91. CONCLUSION: HEALTH LITERACY MEASUREMENTS FOR CAREGIVERS OF CHILDREN WITH COMPLEX MEDICAL CONDITIONS EXCEED THE HEALTH LITERACY RATES OF THE GENERAL POPULATION IN OUR STATE, POTENTIALLY BIASED BY THE INTENSIVE TRAINING PROVIDED TO FAMILIES DURING THEIR PROLONGED HOSPITALIZATION. HEALTHCARE DISPARITIES MAY IMPACT THE MEDICALLY COMPLEX CHILD DIFFERENTLY FROM THE HEALTHY CHILD. ASSUMPTIONS ABOUT HEALTH, WEALTH AND CAREGIVER BURDEN MAY BE INACCURATE AND WARRANT FURTHER EVALUATION. ASSESSING HEALTH LITERACY BEFORE INSTITUTIONALIZATION HAS OCCURRED MAY ENABLE US TO MORE ACCURATELY DESIGN CAREGIVER TRAINING PROGRAMS TO FURTHER AUGMENT LITERACY AND HEALTH LITERACY.","DEPARTMENT OF OTOLARYNGOLOGY - HEAD AND NECK SURGERY, LOUISIANA STATE UNIVERSITY HEALTH SCIENCES CENTER - NEW ORLEANS, 533 BOLIVAR ST.;, SUITE 566, NEW ORLEANS, LA, 70115, USA.; DEPARTMENT OF OTOLARYNGOLOGY - HEAD AND NECK SURGERY, LOUISIANA STATE UNIVERSITY HEALTH SCIENCES CENTER - NEW ORLEANS, 533 BOLIVAR ST.;, SUITE 566, NEW ORLEANS, LA, 70115, USA.; ELECTRONIC ADDRESS: AEVA13@LSUHSC.;EDU.;",NA,"COPYRIGHT 2020 ELSEVIER B.V. ALL RIGHTS RESERVED.",NA,NA,"2021/01/07 20:12","20210623","20201216",2021,"2021/01/08 06:00",NA,NA,NA,"1872-8464 (ELECTRONIC) 0165-5876 (LINKING)","8003603","INTERNATIONAL JOURNAL OF PEDIATRIC OTORHINOLARYNGOLOGY","ENG","S0165-5876(20)30703-5 [PII] 10.1016/J.IJPORL.2020.110560 [DOI]","20210623","2021/06/24 06:00",NA,NA,NA,"NOTNLM","NLM","110560","IRELAND",NA,NA,"33412343","PPUBLISH",NA,"IM",NA,"INT J PEDIATR OTORHINOLARYNGOL. 2021 MAR;142:110560. DOI: 10.1016/J.IJPORL.2020.110560. EPUB 2020 DEC 16.","MEDLINE","INT J PEDIATR OTORHINOLARYNGOL","HEALTH LITERACY RATES AMONG PEDIATRIC TRACHEOSTOMY CAREGIVERS.",NA,"142","S0165-5876(20)30703-5","PUBMED","ADULT;CAREGIVERS;CHILD;HEALTH LITERACY;HEALTH STATUS;HUMANS;MIDDLE AGED;QUALITY OF LIFE;TRACHEOSTOMY;YOUNG ADULT",NA,0,"none","LOUISIANA STATE UNIVERSITY HEALTH SCIENCES CENTER - NEW ORLEANS;LOUISIANA STATE UNIVERSITY HEALTH SCIENCES CENTER - NEW ORLEANS;","LOUISIANA STATE UNIVERSITY HEALTH SCIENCES CENTER - NEW ORLEANS;NOTREPORTED;LOUISIANA STATE UNIVERSITY HEALTH SCIENCES CENTER - NEW ORLEANS;NOTREPORTED;NOTDECLARED;NOTREPORTED",NA,"SETTOON C, 2021, INT J PEDIATR OTORHINOLARYNGOL","SETTOON C, 2021, INT J PEDIATR OTORHINOLARYNGOL"
