"AU","AF","DE","AID","OT","PHST","DT","AB","C1","OI","CI","COIS","CON","CRDT","DCOM","DEP","PY","EDAT","EIN","GR","IS","SN","JID","SO","LA","LID","LR","MHDA","MID","OAB","OABL","OTO","OWN","PP","PL","PMC","PMCR","PMID","PST","RN","SB","SI","SO2","STAT","J9","TI","TT","VL","DI","DB","ID","RP","TC","CR","AU_UN","AU1_UN","AU_UN_NR","SR_FULL","SR"
"VAMOS SD;WACKER CC;WELTER VDE;SCHLTER K","VAMOS, SANDRA D;WACKER, CORINNE C;WELTER, VIRGINIA D E;SCHLTER, KIRSTEN","COVID-19;CHILD;DIET, HEALTHY;FOOD;HEALTH BELIEF MODEL;HEALTH KNOWLEDGE, ATTITUDES, PRACTICE;HEALTH LITERACY;HUMANS;SARS-COV-2;SCHOOLS;SOCIAL CLASS","10.1111/JOSH.13055 [DOI]","*HEALTH LITERACY;*NUTRITION AND DIET;*ORGANIZATION AND ADMINISTRATION OF SCHOOL HEALTH PROGRAMS;*PUBLIC HEALTH;*SCHOOL HEALTH INSTRUCTION","2021/03/25 00:00 [REVISED];2021/03/11 00:00 [RECEIVED];2021/03/29 00:00 [ACCEPTED];2021/06/24 06:00 [PUBMED];2021/08/13 06:00 [MEDLINE];2021/06/23 07:35 [ENTREZ]","JOURNAL ARTICLE;REVIEW","BACKGROUND: FOOD LITERACY, A SUB-AREA OF HEALTH LITERACY, IS ACHIEVING ATTENTION IN SCHOOLS, ACADEMIA, RESEARCH, HEALTH CARE, BUSINESSES, AND GOVERNMENTS WORLDWIDE. AGAINST THE CURRENT COVID-19 PANDEMIC BACKDROP, THE RELEVANCE OF FOOD LITERACY'S INTERCONNECTED ATTRIBUTES SUCH AS NUTRITIONAL KNOWLEDGE, FOOD SKILLS, AND FOOD ENVIRONMENT IS GAINING TRACTION. ENHANCING HEALTH AND FOOD LITERACY IN THE K-12 SCHOOL ENVIRONMENT ARE IMPORTANT EMPOWERMENT TOOLS WITH THE POTENTIAL TO REDUCE HEALTH INEQUALITIES AS VULNERABLE PEOPLE ARE AT RISK OF LIMITED HEALTH LITERACY. METHODS: WE AIM TO CLARIFY THE MEANING OF FOOD LITERACY AND ITS RELATIONSHIP TO HEALTH LITERACY AND OTHER FACTORS INFLUENCING EATING BEHAVIOR. RESULTS: WE OFFER A PROPOSED CONCEPTUAL MODEL DEPICTING CONNECTIONS BETWEEN RELEVANT THEORIES AND CONSTRUCTS IN THE FIELD OF HEALTH AND NUTRITION. CONCRETE ACTIONS ARE OFFERED THAT CONTEMPORARY SCHOOLS CAN TAKE GUIDED BY THE UTILITY OF THE MODEL. CONCLUSIONS: THIS VISUAL CAN HELP GUIDE SCHOOLS' MULTIDIMENSIONAL HEALTH AND FOOD LITERACY EFFORTS WHILE CONSIDERING THE REALITIES OF THE CURRENT COVID-19 PANDEMIC CONTEXT AND BEYOND. THIS MODEL WILL PROVIDE AN OVERARCHING REFERENCE FOR SCHOOLS TO CONSIDER KEY CONSTRUCTS TO SUPPORT PRACTICE, RESEARCH, POLICY, AND INTERVENTION EFFORTS TO ADVANCE THEIR HEALTH AND FOOD LITERACY AGENDAS.","ASSOCIATE PROFESSOR, (SANDRA.;VAMOS@WMICH.;EDU), SCHOOL OF INTERDISCIPLINARY HEALTH PROGRAMS COLLEGE OF HEALTH & HUMAN SERVICES, WESTERN MICHIGAN UNIVERSITY, 1903 W.; MICHIGAN AVE KALAMAZOO, MI, 49008.;, USA.; RESEARCH ASSOCIATE, (CWACKER1@UNI-KOELN.;DE), INSTITUTE OF BIOLOGY EDUCATION, UNIVERSITY OF COLOGNE, HERBERT-LEWIN-STR.; 2, 50931, COLOGNE, GERMANY.; RESEARCH ASSOCIATE, (VIRGINIA.;WELTER@UNI-KOELN.;DE), INSTITUTE OF BIOLOGY EDUCATION, UNIVERSITY OF COLOGNE, HERBERT-LEWIN-STR.; 10, 50931, COLOGNE, GERMANY.; PROFESSOR, (KIRSTEN.;SCHLUETER@UNI-KOELN.;DE), INSTITUTE OF BIOLOGY EDUCATION, UNIVERSITY OF COLOGNE, HERBERT-LEWIN-STR.; 2, 50931, COLOGNE, GERMANY.;","ORCID: 0000-0003-3049-506X"," 2021 AMERICAN SCHOOL HEALTH ASSOCIATION.",NA,NA,"2021/06/23 07:35","20210812","20210622",2021,"2021/06/24 06:00",NA,NA,"8","1746-1561 (ELECTRONIC) 0022-4391 (LINKING)","0376370","THE JOURNAL OF SCHOOL HEALTH","ENG","10.1111/JOSH.13055 [DOI]","20210812","2021/08/13 06:00",NA,NA,NA,"NOTNLM","NLM","650-659","UNITED STATES",NA,NA,"34159604","PPUBLISH",NA,"IM",NA,"J SCH HEALTH. 2021 AUG;91(8):650-659. DOI: 10.1111/JOSH.13055. EPUB 2021 JUN 22.","MEDLINE","J SCH HEALTH","HEALTH LITERACY AND FOOD LITERACY FOR K-12 SCHOOLS IN THE COVID-19 PANDEMIC.",NA,"91","10.1111/JOSH.13055","PUBMED","COVID-19;CHILD;DIET, HEALTHY;FOOD;HEALTH BELIEF MODEL;HEALTH KNOWLEDGE, ATTITUDES, PRACTICE;HEALTH LITERACY;HUMANS;SARS-COV-2;SCHOOLS;SOCIAL CLASS",NA,0,"none","ASSOCIATE PROFESSOR;WESTERN MICHIGAN UNIVERSITY;RESEARCH ASSOCIATE;UNIVERSITY OF COLOGNE;RESEARCH ASSOCIATE;UNIVERSITY OF COLOGNE;SCHLUETER@UNI-KOELN.;UNIVERSITY OF COLOGNE","ASSOCIATE PROFESSOR;NOTREPORTED;WESTERN MICHIGAN UNIVERSITY;NOTREPORTED;NOTREPORTED;RESEARCH ASSOCIATE;UNIVERSITY OF COLOGNE;NOTREPORTED;RESEARCH ASSOCIATE;NOTREPORTED;UNIVERSITY OF COLOGNE;NOTREPORTED;NOTREPORTED;SCHLUETER@UNI-KOELN.;UNIVERSITY OF COLOGNE;NOTREPORTED",NA,"VAMOS SD, 2021, J SCH HEALTH","VAMOS SD, 2021, J SCH HEALTH"
"NETER E;BRAININ E;BARON-EPEL O","NETER, EFRAT;BRAININ, ESTHER;BARON-EPEL, ORNA",NA,"1926256 [PII];10.1080/21642850.2021.1926256 [DOI]","DIGITAL DIVIDE;EHEALTH LITERACY;ETHNIC DIFFERENCES;HEALTH LITERACY;IMMIGRATION","2021/06/09 06:48 [ENTREZ];2021/06/10 06:00 [PUBMED];2021/06/10 06:01 [MEDLINE]","JOURNAL ARTICLE","BACKGROUND: HEATH LITERACY AND EHEALTH LITERACY ARE SKILLS THAT ENABLE INDIVIDUALS TO SEEK, UNDERSTAND AND USE INFORMATION IN WAYS WHICH PROMOTE AND MAINTAIN HEALTH. THE PRESENT STUDY EXAMINED GROUP DIFFERENCES (ETHNICITY, IMMIGRATION) IN BOTH LITERACIES AND WHETHER THERE EXISTS AN ASSOCIATION BETWEEN THE LITERACIES AND POTENTIAL OUTCOMES/GAINS IN HEALTH BEHAVIORS, HEALTH CARE UTILIZATION, PERCEIVED HEALTH AND PERCEIVED OUTCOMES OF INTERNET SEARCH. METHODS: PARTICIPANTS INCLUDED 819 ISRAELI MEN AND WOMEN WHO RESPONDED TO A NATIONALLY REPRESENTATIVE RANDOM-DIGITAL-DIAL (RDD) TELEPHONE SURVEY. RESPONDENTS WERE VETERAN JEWS, IMMIGRANTS FROM THE FORMER SOVIET UNION, AND PALESTINIAN CITIZENS OF ISRAEL. RESULTS: SIGNIFICANT DIFFERENCES BETWEEN THE GROUPS WERE FOUND IN HEALTH LITERACY, ESPECIALLY IN HIGHER ORDERED SKILLS, SO THAT THE IMMIGRANT GROUP WAS THE LOWEST, AFTER ACCOUNTING FOR DEMOGRAPHIC VARIABLES. NO SIGNIFICANT GROUP DIFFERENCES WERE FOUND IN EHEALTH LITERACY. HEALTH LITERACY WAS FOUND TO BE SIGNIFICANTLY ASSOCIATED WITH HEALTHCARE UTILIZATION, PERCEIVED HEALTH AND PERCEIVED OUTCOMES OF INTERNET SEARCH WHILE EHEALTH LITERACY WAS ASSOCIATED WITH PERCEIVED HEALTH AND PERCEIVED OUTCOMES OF INTERNET SEARCH. NO INTERACTION WAS FOUND BETWEEN GROUP AND LITERACIES IN THE PREDICTION OF THE OUTCOMES. CONCLUSIONS: IMMIGRATION HAMPERS HEALTH LITERACY BUT DIFFERENCES ARE AMELIORATED IN EHEALTH LITERACY. FINDING ON ASSOCIATION BETWEEN LITERACIES AND OUTCOMES REPLICATED PREVIOUS ONES AND THE ABSENCE OF MODERATION BY GROUP ATTESTS TO THE ROBUSTNESS OF THE MODELS ON HEALTH LITERACIES.","DEPARTMENT OF BEHAVIORAL SCIENCES, RUPPIN ACADEMIC CENTER, EMEQ HEFER, ISRAEL.; DEPARTMENT OF BEHAVIORAL SCIENCES, RUPPIN ACADEMIC CENTER, EMEQ HEFER, ISRAEL.; FACULTY OF SOCIAL WELFARE AND HEALTH, SCHOOL OF PUBLIC HEALTH, UNIVERSITY OF HAIFA, HAIFA, ISRAEL.;",NA," 2021 THE AUTHOR(S). PUBLISHED BY INFORMA UK LIMITED, TRADING AS TAYLOR & FRANCIS GROUP.","NO POTENTIAL CONFLICT OF INTEREST WAS REPORTED BY THE AUTHOR(S).",NA,"2021/06/09 06:48",NA,"20210515",2021,"2021/06/10 06:00",NA,NA,"1","2164-2850 (ELECTRONIC) 2164-2850 (LINKING)","101624393","HEALTH PSYCHOLOGY AND BEHAVIORAL MEDICINE","ENG","10.1080/21642850.2021.1926256 [DOI]","20210611","2021/06/10 06:01",NA,NA,NA,"NOTNLM","NLM","480-497",NA,"PMC8158255",NA,"34104571","EPUBLISH",NA,NA,NA,"HEALTH PSYCHOL BEHAV MED. 2021 MAY 15;9(1):480-497. DOI: 10.1080/21642850.2021.1926256.","PUBMED-NOT-MEDLINE","HEALTH PSYCHOL BEHAV MED","GROUP DIFFERENCES IN HEALTH LITERACY ARE AMELIORATED IN EHEALTH LITERACY.",NA,"9","10.1080/21642850.2021.1926256","PUBMED",NA,NA,0,"none","RUPPIN ACADEMIC CENTER;RUPPIN ACADEMIC CENTER;UNIVERSITY OF HAIFA","RUPPIN ACADEMIC CENTER;RUPPIN ACADEMIC CENTER;UNIVERSITY OF HAIFA",NA,"NETER E, 2021, HEALTH PSYCHOL BEHAV MED","NETER E, 2021, HEALTH PSYCHOL BEHAV MED"
"WELVERS A;ROSENBERGER KD;CORBRIDGE SJ","WELVERS, ALECIA;ROSENBERGER, KELLY D;CORBRIDGE, SUSAN J","ADULT;FEMALE;HEALTH LITERACY;HUMANS;JAILS;PILOT PROJECTS","00001786-202101000-00015 [PII];10.1097/NCQ.0000000000000477 [DOI]",NA,"2020/02/27 06:00 [PUBMED];2021/08/17 06:00 [MEDLINE];2020/02/27 06:00 [ENTREZ]","JOURNAL ARTICLE","BACKGROUND: LITTLE RESEARCH HAS BEEN DONE TO ADDRESS THE HEALTH LITERACY LEVEL OF DETAINED INDIVIDUALS AND CORRECTIONAL OFFICERS. PURPOSE: THE AIM OF THIS PILOT PROJECT WAS TO DESCRIBE THE HEALTH LITERACY OF INDIVIDUALS DETAINED OR WORKING WITHIN A LARGE URBAN JAIL TO INFORM THEIR HEALTH EDUCATION. METHODS: HEALTH LITERACY ASSESSMENTS WERE CONDUCTED USING THE RAPID ESTIMATE OF ADULT LITERACY IN MEDICINE-SHORT FORM (REALM-SF) AND THE NEWEST VITAL SIGN (NVS) TOOLS. RESULTS: OF THE 48 PARTICIPANTS, 17% (N = 8) EXHIBITED LOW HEALTH LITERACY ON THE REALM-SF, WHEREAS 38% (N = 18) DEMONSTRATED THE NEED FOR IMPROVED HEALTH LITERACY WHEN ASSESSED WITH THE NVS. DETAINED INDIVIDUALS FROM THE WOMEN'S TIERS WERE MORE LIKELY TO HAVE LOWER HEALTH LITERACY THAN THE DETAINED VETERANS OR CORRECTIONAL OFFICERS. CONCLUSIONS: RESULTS INDICATE THAT TAILORED HEALTH EDUCATION PROGRAMMING, USING EVIDENCE-BASED HEALTH LITERACY IMPROVEMENT TECHNIQUES, SHOULD BE OFFERED TO THE INDIVIDUALS DETAINED OR WORKING WITHIN A CORRECTIONAL FACILITY.","UNIVERSITY OF ILLINOIS ROCKFORD REGIONAL CAMPUS (DR ROSENBERGER); AND UNIVERSITY OF ILLINOIS AT CHICAGO (DR CORBRIDGE).; DR WELVERS IS AT RIDGEFIELD, CONNECTICUT.;",NA,"COPYRIGHT 2020 WOLTERS KLUWER HEALTH, INC. ALL RIGHTS RESERVED.","THE AUTHORS DECLARE NO CONFLICTS OF INTEREST.",NA,"2020/02/27 06:00","20210816",NA,2021,"2020/02/27 06:00",NA,NA,"1","1550-5065 (ELECTRONIC) 1057-3631 (LINKING)","9200672","JOURNAL OF NURSING CARE QUALITY","ENG","10.1097/NCQ.0000000000000477 [DOI]","20210816","2021/08/17 06:00",NA,NA,NA,NA,"NLM","84-90","UNITED STATES",NA,NA,"32102026","PPUBLISH",NA,"IM",NA,"J NURS CARE QUAL. 2021 JAN-MAR 01;36(1):84-90. DOI: 10.1097/NCQ.0000000000000477.","MEDLINE","J NURS CARE QUAL","HEALTH LITERACY ASSESSMENT OF DETAINED INDIVIDUALS AND CORRECTIONAL OFFICERS WITHIN A LARGE URBAN JAIL: OPTIMIZING HEALTH EDUCATION.",NA,"36","10.1097/NCQ.0000000000000477","PUBMED","ADULT;FEMALE;HEALTH LITERACY;HUMANS;JAILS;PILOT PROJECTS",NA,0,"none","UNIVERSITY OF ILLINOIS ROCKFORD REGIONAL CAMPUS (DR ROSENBERGER);AND UNIVERSITY OF ILLINOIS AT CHICAGO (DR CORBRIDGE).","UNIVERSITY OF ILLINOIS ROCKFORD REGIONAL CAMPUS (DR ROSENBERGER);AND UNIVERSITY OF ILLINOIS AT CHICAGO (DR CORBRIDGE).;NOTREPORTED",NA,"WELVERS A, 2021, J NURS CARE QUAL","WELVERS A, 2021, J NURS CARE QUAL"
"CLARKE N;DUNNE S;COFFEY L;SHARP L;DESMOND D;O'CONNER J;O'SULLIVAN E;TIMON C;CULLEN C;GALLAGHER P","CLARKE, NICHOLAS;DUNNE, SIMON;COFFEY, LAURA;SHARP, LINDA;DESMOND, DEIRDRE;O'CONNER, JEAN;O'SULLIVAN, ELEANOR;TIMON, CONRAD;CULLEN, CLAIRE;GALLAGHER, PAMELA",NA,"10.1007/S11764-020-00978-5 [PII];10.1007/S11764-020-00978-5 [DOI]","FEAR OF RECURRENCE;HEAD AND NECK CANCER;HEALTH LITERACY;HEALTH-RELATED QUALITY OF LIFE;PSYCHO-ONCOLOGY;SELF-MANAGEMENT","2020/10/15 00:00 [RECEIVED];2020/12/03 00:00 [ACCEPTED];2021/01/10 06:00 [PUBMED];2021/01/10 06:00 [MEDLINE];2021/01/09 12:06 [ENTREZ]","JOURNAL ARTICLE","PURPOSE: LITTLE IS KNOWN ABOUT WHETHER HEALTH LITERACY IS ASSOCIATED WITH AFFECTS CERTAIN KEY OUTCOMES IN HEAD AND NECK CANCER (HNC) SURVIVORS. WE INVESTIGATED (I) THE SOCIO-DEMOGRAPHIC AND CLINICAL PROFILE OF HEALTH LITERACY AND (II) ASSOCIATIONS AMONG BETWEEN HEALTH LITERACY AND SELF-MANAGEMENT BEHAVIOURS, HEALTH-RELATED QUALITY OF LIFE (HRQL) AND FEAR OF RECURRENCE (FOR) IN HNC SURVIVORS. METHODS: A POPULATION-BASED SURVEY WAS CONDUCTED IN IRELAND. HEALTH LITERACY WAS ASSESSED USING A VALIDATED SINGLE-ITEM QUESTION. SOCIO-DEMOGRAPHIC, CLINICAL AND PSYCHOSOCIAL OUTCOME VARIABLES (FOR, SELF-MANAGEMENT BEHAVIOURS, HRQL) WERE COLLECTED. MULTIVARIABLE LINEAR REGRESSION WAS PERFORMED TO ESTIMATE ASSOCIATIONS BETWEEN HEALTH LITERACY AND EACH PSYCHOSOCIAL OUTCOME. RESULTS: THREE HUNDRED NINETY-FIVE (50%) INDIVIDUALS RESPONDED TO THE SURVEY. INADEQUATE HEALTH LITERACY WAS EVIDENT AMONG 47% OF THE SAMPLE. IN ADJUSTED MODELS, HNC SURVIVORS WITH INADEQUATE HEALTH LITERACY HAD SIGNIFICANTLY LOWER LEVELS OF SELF-MANAGEMENT BEHAVIOURS IN THE DOMAINS OF HEALTH-DIRECTED BEHAVIOUR, POSITIVE AND ACTIVE ENGAGEMENT IN LIFE, SELF-MONITORING AND INSIGHT, CONSTRUCTIVE ATTITUDES AND APPROACHES AND SKILLS AND TECHNIQUE ACQUISITION. INADEQUATE HEALTH LITERACY WAS INDEPENDENTLY ASSOCIATED WITH LOWER FUNCTIONAL WELL-BEING AND HNC DISEASE-SPECIFIC HRQL. FOR WAS ALSO SIGNIFICANTLY HIGHER AMONG THOSE WITH INADEQUATE HEALTH LITERACY. CONCLUSIONS: HNC SURVIVORS WITH INADEQUATE HEALTH LITERACY HAVE LOWER LEVELS OF SELF-MANAGEMENT BEHAVIOURS, LOWER FUNCTIONAL HRQL AND INCREASED FOR COMPARED TO THOSE WITH ADEQUATE HEALTH LITERACY. IMPLICATIONS FOR CANCER SURVIVORS: CLINICIANS, HEALTHCARE PROVIDERS AND THOSE DEVELOPING INTERVENTIONS SHOULD CONSIDER HOW INADEQUATE HEALTH LITERACY AMONG HNC SURVIVORS MIGHT AFFECT POST-TREATMENT OUTCOMES WHEN DEVELOPING SERVICES AND PROVIDING SUPPORT FOR THIS GROUP.","SCHOOL OF PSYCHOLOGY, DUBLIN CITY UNIVERSITY, DUBLIN, IRELAND.; NICHOLAS.;CLARKE@DCU.;IE.; SCHOOL OF PSYCHOLOGY, DUBLIN CITY UNIVERSITY, DUBLIN, IRELAND.; DEPARTMENT OF PSYCHOLOGY AND ASSISTING LIVING AND LEARNING INSTITUTE, MAYNOOTH UNIVERSITY, MAYNOOTH, CO.; KILDARE, IRELAND.; POPULATION HEALTH SCIENCES INSTITUTE, NEWCASTLE UNIVERSITY CENTRE FOR CANCER, NEWCASTLE UNIVERSITY, NEWCASTLE, UK.; DEPARTMENT OF PSYCHOLOGY AND ASSISTING LIVING AND LEARNING INSTITUTE, MAYNOOTH UNIVERSITY, MAYNOOTH, CO.; KILDARE, IRELAND.; NATIONAL CANCER REGISTRY IRELAND, BUILDING 6800, CORK AIRPORT BUSINESS PARK, KINSALE ROAD, CORK, IRELAND.; UNIVERSITY COLLEGE CORK DENTAL SCHOOL AND HOSPITAL, CORK, IRELAND.; HEAD AND NECK CANCER PROGRAMME, ST.; JAMES'S HOSPITAL, DUBLIN, IRELAND.; SCHOOL OF NURSING, PSYCHOTHERAPY AND COMMUNITY HEALTH, DCU, DUBLIN, IRELAND.; SCHOOL OF PSYCHOLOGY, DUBLIN CITY UNIVERSITY, DUBLIN, IRELAND.;","ORCID: 0000-0001-8666-5449"," 2021. THE AUTHOR(S), UNDER EXCLUSIVE LICENCE TO SPRINGER SCIENCE+BUSINESS MEDIA, LLC PART OF SPRINGER NATURE.",NA,NA,"2021/01/09 12:06",NA,"20210109",2021,"2021/01/10 06:00",NA,"SRP13GAL/IRISH CANCER SOCIETY/ MRCG/2013/11/HRBI_/HEALTH RESEARCH BOARD/IRELAND","6","1932-2267 (ELECTRONIC) 1932-2259 (LINKING)","101307557","JOURNAL OF CANCER SURVIVORSHIP : RESEARCH AND PRACTICE","ENG","10.1007/S11764-020-00978-5 [DOI]","20211018","2021/01/10 06:00",NA,NA,NA,"NOTNLM","NLM","855-865","UNITED STATES",NA,NA,"33420906","PPUBLISH",NA,"IM",NA,"J CANCER SURVIV. 2021 DEC;15(6):855-865. DOI: 10.1007/S11764-020-00978-5. EPUB 2021 JAN 9.","IN-DATA-REVIEW","J CANCER SURVIV","HEALTH LITERACY IMPACTS SELF-MANAGEMENT, QUALITY OF LIFE AND FEAR OF RECURRENCE IN HEAD AND NECK CANCER SURVIVORS.",NA,"15","10.1007/S11764-020-00978-5","PUBMED",NA,NA,0,"none","DUBLIN CITY UNIVERSITY;DUBLIN CITY UNIVERSITY;MAYNOOTH UNIVERSITY;NEWCASTLE UNIVERSITY CENTRE FOR CANCER;MAYNOOTH UNIVERSITY;UNIVERSITY COLLEGE CORK DENTAL SCHOOL AND HOSPITAL;JAMES'S HOSPITAL;SCHOOL OF NURSING;DUBLIN CITY UNIVERSITY","DUBLIN CITY UNIVERSITY;NOTREPORTED;NOTREPORTED;NOTREPORTED;DUBLIN CITY UNIVERSITY;MAYNOOTH UNIVERSITY;NOTREPORTED;NEWCASTLE UNIVERSITY CENTRE FOR CANCER;MAYNOOTH UNIVERSITY;NOTREPORTED;NOTREPORTED;UNIVERSITY COLLEGE CORK DENTAL SCHOOL AND HOSPITAL;NOTREPORTED;JAMES'S HOSPITAL;SCHOOL OF NURSING;DUBLIN CITY UNIVERSITY",NA,"CLARKE N, 2021, J CANCER SURVIV","CLARKE N, 2021, J CANCER SURVIV"
"NAWABI F;KREBS F;VENNEDEY V;SHUKRI A;LORENZ L;STOCK S","NAWABI, FARAH;KREBS, FRANZISKA;VENNEDEY, VERA;SHUKRI, ARIM;LORENZ, LAURA;STOCK, STEPHANIE","CHILD;FEMALE;HEALTH LITERACY;HEALTH STATUS;HUMANS;PREGNANCY;PREGNANT WOMEN;RANDOMIZED CONTROLLED TRIALS AS TOPIC","IJERPH18073847 [PII];IJERPH-18-03847 [PII];10.3390/IJERPH18073847 [DOI]","*HEALTH BEHAVIOR;*HEALTH LITERACY;*LIFESTYLE;*PREGNANCY;*SYSTEMATIC REVIEW","2021/02/24 00:00 [RECEIVED];2021/03/30 00:00 [REVISED];2021/04/01 00:00 [ACCEPTED];2021/04/30 01:06 [ENTREZ];2021/05/01 06:00 [PUBMED];2021/05/20 06:00 [MEDLINE]","JOURNAL ARTICLE;REVIEW;SYSTEMATIC REVIEW","HEALTH LITERACY PLAYS A CRUCIAL ROLE DURING PREGNANCY, AS THE MOTHER'S HEALTH BEHAVIOR INFLUENCES BOTH HER OWN HEALTH AND THAT OF HER CHILD. TO THE AUTHORS' BEST KNOWLEDGE, NO COMPREHENSIVE OVERVIEW ON EVIDENCE OF THE HEALTH LITERACY OF PREGNANT WOMEN AND ITS IMPACT ON HEALTH OUTCOMES DURING PREGNANCY EXISTS. THEREFORE, THIS REVIEW AIMS TO ASSESS HEALTH LITERACY LEVELS IN PREGNANT WOMEN, WHETHER HEALTH LITERACY IS ASSOCIATED WITH OUTCOMES DURING PREGNANCY AND WHETHER EFFECTIVE INTERVENTIONS EXIST TO IMPROVE THE HEALTH LITERACY OF PREGNANT WOMEN. A SYSTEMATIC LITERATURE SEARCH WAS CONDUCTED IN PUBMED AND EBSCO, RESULTING IN 14 STUDIES. THE RESULTS SHOW MIXED LEVELS OF HEALTH LITERACY IN PREGNANT WOMEN. LIMITED HEALTH LITERACY IS ASSOCIATED WITH UNHEALTHY BEHAVIORS DURING PREGNANCY. MIXED HEALTH LITERACY LEVELS CAN BE ATTRIBUTED TO THE RECRUITMENT SITE, THE NUMBER OF PARTICIPANTS AND THE MEASUREMENT TOOL USED. QUALITY ASSESSMENT REVEALS THAT THE QUALITY OF THE INCLUDED STUDIES IS MODERATE TO GOOD. THE REVIEW REVEALED THAT RANDOMIZED CONTROLLED TRIALS AND INTERVENTIONS TO IMPROVE HEALTH LITERACY IN PREGNANT WOMEN ARE RARE OR DO NOT EXIST. THIS IS CRUCIAL IN THE LIGHT OF THE MIXED HEALTH LITERACY LEVELS FOUND AMONG PREGNANT WOMEN. HEALTHCARE PROVIDERS PLAY A KEY ROLE IN THIS CONTEXT, AS PREGNANT WOMEN WITH LIMITED HEALTH LITERACY RELY ON THEM AS SOURCES OF HEALTH INFORMATION.","INSTITUTE OF HEALTH ECONOMICS AND CLINICAL EPIDEMIOLOGY, UNIVERSITY HOSPITAL COLOGNE (AR), 50935 COLOGNE, GERMANY.; INSTITUTE OF HEALTH ECONOMICS AND CLINICAL EPIDEMIOLOGY, UNIVERSITY HOSPITAL COLOGNE (AR), 50935 COLOGNE, GERMANY.; INSTITUTE OF HEALTH ECONOMICS AND CLINICAL EPIDEMIOLOGY, UNIVERSITY HOSPITAL COLOGNE (AR), 50935 COLOGNE, GERMANY.; INSTITUTE OF HEALTH ECONOMICS AND CLINICAL EPIDEMIOLOGY, UNIVERSITY HOSPITAL COLOGNE (AR), 50935 COLOGNE, GERMANY.; INSTITUTE OF HEALTH ECONOMICS AND CLINICAL EPIDEMIOLOGY, UNIVERSITY HOSPITAL COLOGNE (AR), 50935 COLOGNE, GERMANY.; INSTITUTE OF HEALTH ECONOMICS AND CLINICAL EPIDEMIOLOGY, UNIVERSITY HOSPITAL COLOGNE (AR), 50935 COLOGNE, GERMANY.;","ORCID: 0000-0002-9433-1390 ORCID: 0000-0002-5998-3801 ORCID: 0000-0003-2799-5784",NA,"THE AUTHORS DECLARE NO CONFLICT OF INTEREST.",NA,"2021/04/30 01:06","20210519","20210406",2021,"2021/05/01 06:00",NA,NA,"7","1660-4601 (ELECTRONIC) 1661-7827 (PRINT) 1660-4601 (LINKING)","101238455","INTERNATIONAL JOURNAL OF ENVIRONMENTAL RESEARCH AND PUBLIC HEALTH","ENG","10.3390/IJERPH18073847 [DOI] 3847","20210519","2021/05/20 06:00",NA,NA,NA,"NOTNLM","NLM",NA,NA,"PMC8038834",NA,"33917631","EPUBLISH",NA,"IM",NA,"INT J ENVIRON RES PUBLIC HEALTH. 2021 APR 6;18(7):3847. DOI: 10.3390/IJERPH18073847.","MEDLINE","INT J ENVIRON RES PUBLIC HEALTH","HEALTH LITERACY IN PREGNANT WOMEN: A SYSTEMATIC REVIEW.",NA,"18","10.3390/IJERPH18073847","PUBMED","CHILD;FEMALE;HEALTH LITERACY;HEALTH STATUS;HUMANS;PREGNANCY;PREGNANT WOMEN;RANDOMIZED CONTROLLED TRIALS AS TOPIC",NA,0,"none","UNIVERSITY HOSPITAL COLOGNE (AR);UNIVERSITY HOSPITAL COLOGNE (AR);UNIVERSITY HOSPITAL COLOGNE (AR);UNIVERSITY HOSPITAL COLOGNE (AR);UNIVERSITY HOSPITAL COLOGNE (AR);UNIVERSITY HOSPITAL COLOGNE (AR)","UNIVERSITY HOSPITAL COLOGNE (AR);UNIVERSITY HOSPITAL COLOGNE (AR);UNIVERSITY HOSPITAL COLOGNE (AR);UNIVERSITY HOSPITAL COLOGNE (AR);UNIVERSITY HOSPITAL COLOGNE (AR);UNIVERSITY HOSPITAL COLOGNE (AR)",NA,"NAWABI F, 2021, INT J ENVIRON RES PUBLIC HEALTH","NAWABI F, 2021, INT J ENVIRON RES PUBLIC HEALTH"
"LI S;CUI G;KAMINGA AC;CHENG S;XU H","LI, SHAOJIE;CUI, GUANGHUI;KAMINGA, ATIPATSA CHIWANDA;CHENG, SIXIANG;XU, HUILAN","ADOLESCENT;ADULT;ASIANS/STATISTICS & NUMERICAL DATA;COVID-19/EPIDEMIOLOGY/PREVENTION & CONTROL;CHINA/EPIDEMIOLOGY;CROSS-SECTIONAL STUDIES;HEALTH BEHAVIOR;HEALTH KNOWLEDGE, ATTITUDES, PRACTICE;HEALTH LITERACY/STATISTICS & NUMERICAL DATA;HUMANS;INTERNET;MALE;PANDEMICS;SARS-COV-2/ISOLATION & PURIFICATION;SOCIAL FACTORS;STUDENTS;SURVEYS AND QUESTIONNAIRES;TELEMEDICINE/METHODS;UNIVERSITIES;YOUNG ADULT","V23I5E25600 [PII];10.2196/25600 [DOI]","*COVID-19;*COVID-19RELATED HEALTH BEHAVIOR QUESTIONNAIRE;*CHINESE COLLEGE STUDENTS;*EHEALTH LITERACY;*HEALTH LITERACY","2020/11/08 00:00 [RECEIVED];2021/04/03 00:00 [ACCEPTED];2021/01/29 00:00 [REVISED];2021/04/07 06:00 [PUBMED];2021/05/22 06:00 [MEDLINE];2021/04/06 17:17 [ENTREZ]","JOURNAL ARTICLE","BACKGROUND: DURING THE COVID-19 PANDEMIC, THE INTERNET HAS SIGNIFICANTLY SPREAD INFORMATION, PROVIDING PEOPLE WITH KNOWLEDGE AND ADVICE ABOUT HEALTH PROTECTION REGARDING COVID-19. WHILE A PREVIOUS STUDY DEMONSTRATED THAT HEALTH AND EHEALTH LITERACY ARE RELATED TO COVID-19 PREVENTION BEHAVIORS, FEW STUDIES HAVE FOCUSED ON THE RELATIONSHIP BETWEEN HEALTH LITERACY, EHEALTH LITERACY, AND COVID-19-RELATED HEALTH BEHAVIORS. THE LATTER INCLUDES NOT ONLY PREVENTATIVE BEHAVIORS BUT ALSO CONVENTIONAL HEALTH BEHAVIORS. OBJECTIVE: THE OBJECTIVE OF THIS STUDY WAS TO DEVELOP AND VERIFY A COVID-19-RELATED HEALTH BEHAVIOR QUESTIONNAIRE, EXPLORE ITS STATUS AND STRUCTURE, AND EXAMINE THE ASSOCIATIONS BETWEEN THESE BEHAVIORS AND PARTICIPANTS' HEALTH LITERACY AND EHEALTH LITERACY. METHODS: A SNOWBALL SAMPLING METHOD WAS ADOPTED TO RECRUIT PARTICIPANTS TO COMPLETE ANONYMOUS CROSS-SECTIONAL QUESTIONNAIRE SURVEYS ONLINE THAT ASSESSED SOCIODEMOGRAPHIC INFORMATION, SELF-REPORTED CORONAVIRUS KNOWLEDGE, HEALTH LITERACY, EHEALTH LITERACY, AND COVID-19-RELATED HEALTH BEHAVIORS. RESULTS: OF 1873 COLLEGE STUDENTS WHO WERE RECRUITED, 781 (41.7%) HAD ADEQUATE HEALTH LITERACY; THE MEAN EHEALTH LITERACY SCORE WAS 30.16 (SD 6.31). THE COVID-19-RELATED HEALTH BEHAVIOR QUESTIONNAIRE PRESENTED A TWO-FACTOR STRUCTURE-COVID-19-SPECIFIC PRECAUTIONARY BEHAVIORS AND CONVENTIONAL HEALTH BEHAVIORS-WITH SATISFACTORY FIT INDICES AND INTERNAL CONSISTENCY (CRONBACH =.79). THE MEAN SCORE OF COVID-19-RELATED HEALTH BEHAVIORS WAS 53.77 (SD 8.03), AND SCORES DIFFERED SIGNIFICANTLY (P<.05) WITH RESPECT TO RESIDENCE, COLLEGE YEAR, ACADEMIC MAJOR, FAMILY ECONOMIC LEVEL, SELF-REPORTED HEALTH STATUS, HAVING A FAMILY MEMBER OR FRIEND INFECTED WITH CORONAVIRUS, AND HEALTH LITERACY LEVEL. LINEAR REGRESSION ANALYSIS SHOWED THAT HEALTH LITERACY AND EHEALTH LITERACY WERE POSITIVELY ASSOCIATED WITH COVID-19-SPECIFIC PRECAUTIONARY BEHAVIORS ((HEALTH LITERACY)=.149, (EHEALTH LITERACY)=.368; P<.001) AND CONVENTIONAL HEALTH BEHAVIORS ((HEALTH LITERACY)=.219, (EHEALTH LITERACY)=.277; P<.001). CONCLUSIONS: THE COVID-19-RELATED HEALTH BEHAVIOR QUESTIONNAIRE WAS A VALID AND RELIABLE MEASURE FOR ASSESSING HEALTH BEHAVIORS DURING THE PANDEMIC. COLLEGE STUDENTS WITH HIGHER HEALTH LITERACY AND EHEALTH LITERACY CAN MORE ACTIVELY ADOPT COVID-19-RELATED HEALTH BEHAVIORS. ADDITIONALLY, COMPARED TO HEALTH LITERACY, EHEALTH LITERACY IS MORE CLOSELY RELATED TO COVID-19-RELATED HEALTH BEHAVIORS. PUBLIC INTERVENTION MEASURES BASED ON HEALTH AND EHEALTH LITERACY ARE REQUIRED TO PROMOTE COVID-19-RELATED HEALTH BEHAVIORS DURING THE PANDEMIC, WHICH MAY BE HELPFUL TO REDUCE THE RISK OF COVID-19 INFECTION AMONG COLLEGE STUDENTS.","DEPARTMENT OF SOCIAL MEDICINE AND HEALTH MANAGEMENT, XIANGYA SCHOOL OF PUBLIC HEALTH, CENTRAL SOUTH UNIVERSITY, CHANGSHA, CHINA.; SCHOOL OF ACUPUNCTURE AND TUINA, SHANDONG UNIVERSITY OF TRADITIONAL CHINESE MEDICINE, JINAN, CHINA.; DEPARTMENT OF MATHEMATICS AND STATISTICS, MZUZU UNIVERSITY, LUWINGA, MALAWI.; DEPARTMENT OF EPIDEMIOLOGY AND HEALTH STATISTICS, XIANGYA SCHOOL OF PUBLIC HEALTH, CENTRAL SOUTH UNIVERSITY, CHANGSHA, CHINA.; DEPARTMENT OF SOCIAL MEDICINE AND HEALTH MANAGEMENT, XIANGYA SCHOOL OF PUBLIC HEALTH, CENTRAL SOUTH UNIVERSITY, CHANGSHA, CHINA.; DEPARTMENT OF SOCIAL MEDICINE AND HEALTH MANAGEMENT, XIANGYA SCHOOL OF PUBLIC HEALTH, CENTRAL SOUTH UNIVERSITY, CHANGSHA, CHINA.;","ORCID: 0000-0003-1366-5813 ORCID: 0000-0003-2050-6191 ORCID: 0000-0002-6556-4590 ORCID: 0000-0002-3379-4818 ORCID: 0000-0003-4845-2252","SHAOJIE LI, GUANGHUI CUI, ATIPATSA CHIWANDA KAMINGA, SIXIANG CHENG, HUILAN XU. ORIGINALLY PUBLISHED IN THE JOURNAL OF MEDICAL INTERNET RESEARCH (HTTPS://WWW.JMIR.ORG), 06.05.2021.","CONFLICTS OF INTEREST: NONE DECLARED.",NA,"2021/04/06 17:17","20210521","20210506",2021,"2021/04/07 06:00",NA,NA,"5","1438-8871 (ELECTRONIC) 1439-4456 (PRINT) 1438-8871 (LINKING)","100959882","JOURNAL OF MEDICAL INTERNET RESEARCH","ENG","10.2196/25600 [DOI] E25600","20211204","2021/05/22 06:00",NA,NA,NA,"NOTNLM","NLM","E25600",NA,"PMC8104003",NA,"33822734","EPUBLISH",NA,"IM",NA,"J MED INTERNET RES. 2021 MAY 6;23(5):E25600. DOI: 10.2196/25600.","MEDLINE","J MED INTERNET RES","ASSOCIATIONS BETWEEN HEALTH LITERACY, EHEALTH LITERACY, AND COVID-19-RELATED HEALTH BEHAVIORS AMONG CHINESE COLLEGE STUDENTS: CROSS-SECTIONAL ONLINE STUDY.",NA,"23","10.2196/25600","PUBMED","ADOLESCENT;ADULT;ASIANS/STATISTICS & NUMERICAL DATA;COVID-19/EPIDEMIOLOGY/PREVENTION & CONTROL;CHINA/EPIDEMIOLOGY;CROSS-SECTIONAL STUDIES;HEALTH BEHAVIOR;HEALTH KNOWLEDGE, ATTITUDES, PRACTICE;HEALTH LITERACY/STATISTICS & NUMERICAL DATA;HUMANS;INTERNET;MALE;PANDEMICS;SARS-COV-2/ISOLATION & PURIFICATION;SOCIAL FACTORS;STUDENTS;SURVEYS AND QUESTIONNAIRES;TELEMEDICINE/METHODS;UNIVERSITIES;YOUNG ADULT",NA,0,"none","CENTRAL SOUTH UNIVERSITY;SHANDONG UNIVERSITY OF TRADITIONAL CHINESE MEDICINE;MZUZU UNIVERSITY;CENTRAL SOUTH UNIVERSITY;CENTRAL SOUTH UNIVERSITY;CENTRAL SOUTH UNIVERSITY","CENTRAL SOUTH UNIVERSITY;SHANDONG UNIVERSITY OF TRADITIONAL CHINESE MEDICINE;MZUZU UNIVERSITY;CENTRAL SOUTH UNIVERSITY;CENTRAL SOUTH UNIVERSITY;CENTRAL SOUTH UNIVERSITY",NA,"LI S, 2021, J MED INTERNET RES","LI S, 2021, J MED INTERNET RES"
